Title,Article,Category
Rishabh Instruments IPO: Company's Rs 491-Crore Public Issue To Open On August 30,,Business
Vedanta Looking For Separate Listings Of Different Businesses: Chairman Anil Agarwal,,Business
"AI Will Create More Jobs In India, Says B20 Chair N Chandrasekaran",,Business
Investing For Prosperity: Exploring Fixed Deposits,,Business
"B20 Summit: India Stands As Beacon Of Growth, On Track For 7 Per Cent Growth Over The Decade, Says N Chandrasekaran",,Business
BSE Defers Removal Of Jio Financial Services From Indices To September 1,,Business
'What Happened To Bulldozers And Thok Do': Opposition Attacks Yogi Govt Over Muzaffarnagar Teacher Video,,Business
"'If You Have Any Shame, Resign': Amit Shah Attacks Rajasthan CM Gehlot Over 'Red Diary' Row",,Business
"Madurai Train Fire — 'Doors Locked, People Stuck Inside': Passengers Recall Tamil Nadu Railway Station Horror",,Business
"Muzaffarnagar School Matter Being 'Taken Seriously', FIR Registered: UP Deputy CM Pathak",,Business
Was Under Pressure. Made Students Beat Up Classmate As I'm Handicapped: Teacher Seen In Muzaffarnagar Video,,Business
"After Chandrayaan-3 Triumph, India To Send Female Robot 'Vyommitra' To Space Under Gaganyaan Mission",,Business
Tiranga And Shiv Shakti: India Names Two Areas On Moon Related To Chandrayaan Missions,,Business
"WATCH: Chandigarh Cops, AAP Leaders Argue Over Permission To Protest Against Haryana Minister",,Business
'Would've Been A Matter Of Pride If...': Congress Questions PM Modi's Bengaluru Roadshow Ahead Of ISRO Visit,,Business
"Kuber Group Boss Vikas Malu Among 4 Hurt In Rolls-Royce & Oil Tanker Crash In Nuh, SIT Formed: Reports",,Business
"India's forex reserves drop $ 7.27 billion to $ 594.88 billion 
 ",The reserves took a hit as the central bank deployed the kitty to defend the rupee amid pressures caused majorly by global developments since last year.,Business
"Centre not to extend deadline for mandatory use of Aadhaar-based payment for MGNREGS
 ","This deadline was subsequently extended to March 31, then further to June 30, and finally to August 31. ",Business
"Sensex, Nifty rise in opening trade as stock market cheers Chandrayaan-3 successful landing on Moon 
 ","Sensex-Nifty: In the Nifty segment, 47 firms witnessed advances, while only four recorded declines, with none remaining unchanged. ",Business
"India's GDP growth in Q1 FY24 to exceed RBI's estimate of 8%, say economists
 ","The RBI had forecast a growth of 8% in the April-June quarter in its monetary policy statement in June. However, economists believe that the actual growth could be higher, at around 8.3% to 8.5%.
",Business
"Multibagger: Agri products stock launches new product line as packaged food market to achieve $86bn
",GMR is a small cap stock and primarily engaged in the agricultural products industry. It is the third largest basmati rice exporter in India. ,Business
"Centre to fully implement rice fortification programme before March 2024 target
","Thereafter, a scheme for the distribution of fortified rice, containing prescribed micronutrients (Iron, Folic Acid, Vitamin B12) was launched in October 2021 in a phased manner in order to address the problem of anaemia in children and women.",Business
"Adani Enterprises shares climb over 2 per cent after promoter group increases its stake
","The stock ended at Rs 2,697.70, up 2.24 per cent on the BSE. ",Business
"Central govt likely to hike amount under PM Kisan Samman Nidhi | Details
","Currently, the amount received by the farmers under this scheme is Rs 6,000 in three installments. ",Business
"Go First crisis deepens as 500 pilots quit, more employees leave: Report
 ","Go First had invited Expressions of Interest (EOI) from potential buyers in July, but the deadline for submitting EOIs has been extended to September 8. This has further frustrated employees, who are worried about their future.


",Business
"EPFO added 17.89 lakh net members in June this year in 11-month high, says govt data
 ","This is the highest number of net additions in the last 11 months. The data also shows that the EPFO's monthly average wage grew by 10.47% in June 2023 to Rs. 21,237. ",Business
"In a boost to Make in India, Hyderabad-based mobile retail chain to invest Rs 300 crore
","In a release, the Hyderabad--based firm said that the plan is to invest around Rs 300 crore to open 150 new outlets in the next two years. This will mark a major win for the Modi government's 'Make in India' programme.",Business
"'Sufficient coal stock available to meet demand of power plants during monsoon'
","The meeting comes just days after Coal and Mines Minister Pralhad Joshi had last week reviewed the availability of coal, where it was informed that there is adequate supply of dry fuel to meet the requirements of coal-based power plants. ",Business
"India's rank moves up to 11th position in global direct selling 
 ",The WFDSA report mentioned that the global direct selling industry reported a decline of 1.5 per cent in 2022 to USD 172.89 billion.,Business
"Jio Financial Services shares fall nearly 5 pc in debut trade
 ","In volume terms, 35.51 lakh shares of the company were traded on the BSE and over 7.47 crore shares on the NSE.",Business
"Delhi: Government to sell onions at Rs 25 per kg in national capital from today
 ","The government has taken this step to provide relief to consumers from the high prices of onions, which have been hovering around Rs 40–50 per kg in recent weeks. ",Business
"How will China's slide into deflation impact Indian and global economy? Know in detail
 ","The net impact of China's deflation on India will depend on a number of factors, including the severity of the slowdown, the extent to which it affects global trade, and the Indian government's response.",Business
