Title,Article,Category
"Oil prices change as China worries against expectations of tighter supply in US   
","Oil prices were little changed today as investors weighed worries about China's embattled economy against expectations of tighter supply in the United States.
",Business
"Rupee closes at 82.95 against US dollar
","In the forex market, the rupee closed at 82 rupees and 95 paise against the US dollar.
",Business
"New Mineral Regulation Act Aims to Boost Private Investment and Self-Reliance in Mining Sector
","In a recent discussion on Akashvani's program ""Spotlight,"" the spotlight was on the Mines and Minerals Development and Regulation Act 2023, a game-changing policy reform aimed at revitalizing India's mineral sector.",Business
"Russia hikes interest rates to 12% after Rouble falls to its lowest value in 16 months
","Russia has hiked interest rates to 12 percent after the rouble fell to its lowest value in 16 months. The currency fell past 100 per dollar yesterday, prompting Russia's central bank to hold an emergency meeting.",Business
"India’s overall exports in July this year estimated at 59.43 billion dollars, despite global headwinds
","India’s overall exports in July this year are estimated at 59.43 billion dollars, despite global headwinds. ",Business
"Centre to E-auction 50 Lakh MT of wheat and 25 LMT of rice to tame inflation and enhance food availability
",The Centre has decided to release 50 Lakh Metric Tonnes of wheat and 25 LMT of rice through E-auctions under the Open Market Sale Scheme (Domestic) or OMSS (D) scheme.,Business
"Index of Industrial Production growth at 3.7 percent in June 2023 from 5.3 percent in May 2023
","The index of industrial production grew by 3.7 percent in June 2023 from 5.3 percent in May this year. As per the Ministry of Statistics and Programme Implementation data released today, manufacturing sector's output grew by 3.1 percent and Mining output rose by 7.6 percent for the reported peri",Business
"Asian stock markets end in red; European Markets also down in intra-day trade
",Asian stock markets today ended in red. China's Shanghai Composite index declined two percent and Hong Kong's Hang Seng index depreciated 0.9 percent.,Business
"Wall Street's main indices end in green as investors worry about U.S. economy's longer-term prospects
","Wall Street's main indices ended in green yesterday, due to milder-than-feared inflation data as investors worried about the U.S. economy's longer-term prospects.",Business
"Forex Market: Rupee closes at 82.84 against US dollar
","In the forex market, the rupee closed at 82 rupees and 84 paise against the US dollar.",Business
"US benchmark stocks finished lower in broad sell-off after downgrading of several lenders by credit rating agency Moody
",All three major US benchmark stocks finished lower yesterday in a broad sell-off after the downgrading of several lenders by credit rating agency Moody. ,Business
"Gold prices fall Rs 40, trades at Rs 59,380/ 10 gram
","Gold prices today fell 40 rupees at Multi Commodity Exchange for October contracts. The precious metal was trading at 59,380 rupees per 10 grams.",Business
"Asian stock markets traded mixed
",Asian stock markets today traded mixed. Japan's Nikkei-225 gained 0.4 percent and Singapore's Straits Times index rose marginally by 0.1 percent.,Business
"Oil prices surge to highest levels since mid-April after Saudi Arabia and Russia pledge to extend supply cuts
","Oil prices on Monday (07 August 2023) surged to their highest levels since mid-April, after top producers Saudi Arabia and Russia pledged to extend supply cuts through September, further tightening supplies.",Business
"Global crude oil prices rise for 6th straight week, after top producers Saudi Arabia & Russia extended supply cuts through September, adding to undersupply concerns
","Global crude oil prices rose for the sixth straight week, after top producers Saudi Arabia and Russia extended supply cuts through September, adding to undersupply concerns.",Business
"Centre clarifies there is no ban on import of IT Hardware like tablets and laptops after obtaining valid license
",The Centre has clarified that there is no ban on the import of IT Hardware like tablets and laptops as such devices can be imported after obtaining a valid license by companies or traders. ,Business
"Oil slid further after dropping sharply from more than three-month highs in previous session
",Oil slid further today after dropping sharply from more than three-month highs in the previous session.,Business
"<h6><a href=""News?title=Oil-slid-further-after-dropping-sharply-from-more-than-three-month-highs-in-previous-session&amp;id=465227"">Oil slid further after dropping sharply from more than three-month highs in previous session</a>
</h6>","<p><span id=""ctl00_ContentPlaceHolder1_AddUserControl_RepterDetails_ctl21_lblComment"">Oil slid further today after dropping sharply from more than three-month highs in the previous session.</span></p>",Business
"<h6><a href=""News?title=Oil-slid-further-after-dropping-sharply-from-more-than-three-month-highs-in-previous-session&amp;id=465227"">Oil slid further after dropping sharply from more than three-month highs in previous session</a>
</h6>","<p><span id=""ctl00_ContentPlaceHolder1_AddUserControl_RepterDetails_ctl21_lblComment"">Oil slid further today after dropping sharply from more than three-month highs in the previous session.</span></p>",Business
"<h6><a href=""News?title=Oil-slid-further-after-dropping-sharply-from-more-than-three-month-highs-in-previous-session&amp;id=465227"">Oil slid further after dropping sharply from more than three-month highs in previous session</a>
</h6>",Top 10 Things Karanataka Produces The Highest,Business
"<h6><a href=""News?title=Oil-slid-further-after-dropping-sharply-from-more-than-three-month-highs-in-previous-session&amp;id=465227"">Oil slid further after dropping sharply from more than three-month highs in previous session</a>
</h6>",Top 7 Business Movies On Netflix No One Should Miss,Business
"<h6><a href=""News?title=Oil-slid-further-after-dropping-sharply-from-more-than-three-month-highs-in-previous-session&amp;id=465227"">Oil slid further after dropping sharply from more than three-month highs in previous session</a>
</h6>","Centre Makes Police and Biometric Verifications Mandatory For SIM Card Dealers, Discontinue Bulk Connections",Business
"<h6><a href=""News?title=Oil-slid-further-after-dropping-sharply-from-more-than-three-month-highs-in-previous-session&amp;id=465227"">Oil slid further after dropping sharply from more than three-month highs in previous session</a>
</h6>",Top 10 Countries with the Largest Pakistani Population,Business
"<h6><a href=""News?title=Oil-slid-further-after-dropping-sharply-from-more-than-three-month-highs-in-previous-session&amp;id=465227"">Oil slid further after dropping sharply from more than three-month highs in previous session</a>
</h6>",10 Longest Highways In India: Check Routes,Business
"<h6><a href=""News?title=Oil-slid-further-after-dropping-sharply-from-more-than-three-month-highs-in-previous-session&amp;id=465227"">Oil slid further after dropping sharply from more than three-month highs in previous session</a>
</h6>",List Of Countries Where X.com Is Banned,Business
"<h6><a href=""News?title=Oil-slid-further-after-dropping-sharply-from-more-than-three-month-highs-in-previous-session&amp;id=465227"">Oil slid further after dropping sharply from more than three-month highs in previous session</a>
</h6>",Top 10 Richest Women In The World,Business
"<h6><a href=""News?title=Oil-slid-further-after-dropping-sharply-from-more-than-three-month-highs-in-previous-session&amp;id=465227"">Oil slid further after dropping sharply from more than three-month highs in previous session</a>
</h6>",Top 10 Indian Unicorns That Created Highest Jobs,Business
"<h6><a href=""News?title=Oil-slid-further-after-dropping-sharply-from-more-than-three-month-highs-in-previous-session&amp;id=465227"">Oil slid further after dropping sharply from more than three-month highs in previous session</a>
</h6>",Top 10 Richest Families In The World - InPics,Business
"<h6><a href=""News?title=Oil-slid-further-after-dropping-sharply-from-more-than-three-month-highs-in-previous-session&amp;id=465227"">Oil slid further after dropping sharply from more than three-month highs in previous session</a>
</h6>",10 Things To Identify In Train Ticket,Business
"<h6><a href=""News?title=Oil-slid-further-after-dropping-sharply-from-more-than-three-month-highs-in-previous-session&amp;id=465227"">Oil slid further after dropping sharply from more than three-month highs in previous session</a>
</h6>",Orange-Colour Vande Bharat Train To Be Unveiled On Aug 19,Business
"<h6><a href=""News?title=Oil-slid-further-after-dropping-sharply-from-more-than-three-month-highs-in-previous-session&amp;id=465227"">Oil slid further after dropping sharply from more than three-month highs in previous session</a>
</h6>",Top 10 Foreign Born Founders Of  Billion Dollar American Companies,Business
"<h6><a href=""News?title=Oil-slid-further-after-dropping-sharply-from-more-than-three-month-highs-in-previous-session&amp;id=465227"">Oil slid further after dropping sharply from more than three-month highs in previous session</a>
</h6>",10 Business Books That Will Change The Way You Look At Business,Business
"<h6><a href=""News?title=Oil-slid-further-after-dropping-sharply-from-more-than-three-month-highs-in-previous-session&amp;id=465227"">Oil slid further after dropping sharply from more than three-month highs in previous session</a>
</h6>",Rakesh Jhunjhunwala: 10 Lesser Known Facts About India's Big Bull,Business
"<h6><a href=""News?title=Oil-slid-further-after-dropping-sharply-from-more-than-three-month-highs-in-previous-session&amp;id=465227"">Oil slid further after dropping sharply from more than three-month highs in previous session</a>
</h6>",10 Famous Brands That You Thought Were INDIAN But ...,Business
"<h6><a href=""News?title=Oil-slid-further-after-dropping-sharply-from-more-than-three-month-highs-in-previous-session&amp;id=465227"">Oil slid further after dropping sharply from more than three-month highs in previous session</a>
</h6>",Top 7 Ways To Break Your Phone Addiction,Business
"<h6><a href=""News?title=Oil-slid-further-after-dropping-sharply-from-more-than-three-month-highs-in-previous-session&amp;id=465227"">Oil slid further after dropping sharply from more than three-month highs in previous session</a>
</h6>",10 Richest YouTubers In The World 2023,Business
"<h6><a href=""News?title=Oil-slid-further-after-dropping-sharply-from-more-than-three-month-highs-in-previous-session&amp;id=465227"">Oil slid further after dropping sharply from more than three-month highs in previous session</a>
</h6>",Top 10 Things You Must Know About DigiYatra App,Business
"<h6><a href=""News?title=Oil-slid-further-after-dropping-sharply-from-more-than-three-month-highs-in-previous-session&amp;id=465227"">Oil slid further after dropping sharply from more than three-month highs in previous session</a>
</h6>",10 Richest Indian YouTubers And Their Net Worth,Business
"<h6><a href=""News?title=Oil-slid-further-after-dropping-sharply-from-more-than-three-month-highs-in-previous-session&amp;id=465227"">Oil slid further after dropping sharply from more than three-month highs in previous session</a>
</h6>",20 Habits That Can Change Your Life in 6 Months,Business
This 23-Year-Old Kanpur Man Became India's 1st-Ever Chief Gaming Officer With iQOO,"

















 Business Analiza Pathak  August 17, 2023 4:23 PM IST ",Business
"Air India Announces Four-day Sale, Fares Start at Rs 1,470 | Check Dates And Other Benefits Here","

















 Business Victor Dasgupta  August 17, 2023 3:46 PM IST ",Business
Vistara To Pay Medical Expenses For 10-Year-Old Child Burned On Frankfurt Flight,"

















 Business Analiza Pathak  August 17, 2023 2:16 PM IST ",Business
RBI's Pilot Project For Public Tech Platform For Frictionless Credit To Start Today; Check Benefits,"

















 Business India.com Business Desk  August 17, 2023 12:43 PM IST ",Business
"IndiGo To Start Direct Flight Services From New Delhi To Tashkent From Sept 6, DGCA Confirms","

















 Business Analiza Pathak  August 17, 2023 10:57 AM IST ",Business
SBI Amrit Kalash FD Scheme Deadline Extended Till Dec 31: Here   s How Senior Citizens Will be Benefitted,"

















 Business Manmath Nayak  August 17, 2023 10:42 AM IST ",Business
When Will Centre Hike Dearness Allowance For Govt Employees? Check Expected Date Here,"

















 Business Manmath Nayak  August 17, 2023 9:46 AM IST ",Business
"Petrol Available at Rs 97 Per Litre in Noida: Check Fuel Prices in Delhi, Ghaziabad, Other Cities","

















 Business India.com Business Desk  August 17, 2023 8:53 AM IST ",Business
"Go First Faces Another Challenge, 150 Employees Likely To Resign Over Non-payment of Salaries: Report","

















 Business Manmath Nayak  August 17, 2023 7:23 AM IST ",Business
"Air India Express Plans To Rebrand Aircraft With New Logo, Livery; Here's When it Will be Launched","

















 Business Manmath Nayak  August 16, 2023 5:54 PM IST ",Business
"Axis Bank, Canara Bank Revise Interest Rates on Fixed Deposits: Check Latest Rates Here","

















 Business Manmath Nayak  August 16, 2023 3:56 PM IST ",Business
"Go First Airline Cancels Flight Operations Till August 18, Here's Why","

















 Business Manmath Nayak  August 16, 2023 12:54 PM IST ",Business
"Petrol Price Slashed by 49 Paise in Maharashtra: Check Fuel Rates in Delhi, Kolkata, Other Cities","

















 Business Manmath Nayak  August 16, 2023 10:19 AM IST ",Business
"Petrol Price Slashed by 49 Paise in Maharashtra: Check Fuel Rates in Delhi, Kolkata, Other Cities","

















 Business Manmath Nayak  August 16, 2023 10:19 AM IST ",Business
"Petrol Price Slashed by 49 Paise in Maharashtra: Check Fuel Rates in Delhi, Kolkata, Other Cities","

















 Business Manmath Nayak  August 16, 2023 10:19 AM IST ",Business
"Petrol Price Slashed by 49 Paise in Maharashtra: Check Fuel Rates in Delhi, Kolkata, Other Cities","

















 Business Manmath Nayak  August 16, 2023 10:19 AM IST ",Business
"Petrol Price Slashed by 49 Paise in Maharashtra: Check Fuel Rates in Delhi, Kolkata, Other Cities","

















 Business Manmath Nayak  August 16, 2023 10:19 AM IST ",Business
"Petrol Price Slashed by 49 Paise in Maharashtra: Check Fuel Rates in Delhi, Kolkata, Other Cities","

















 Business Manmath Nayak  August 16, 2023 10:19 AM IST ",Business
"Petrol Price Slashed by 49 Paise in Maharashtra: Check Fuel Rates in Delhi, Kolkata, Other Cities","

















 Business Manmath Nayak  August 16, 2023 10:19 AM IST ",Business
"Petrol Price Slashed by 49 Paise in Maharashtra: Check Fuel Rates in Delhi, Kolkata, Other Cities","

















 Business Manmath Nayak  August 16, 2023 10:19 AM IST ",Business
"Petrol Price Slashed by 49 Paise in Maharashtra: Check Fuel Rates in Delhi, Kolkata, Other Cities","

















 Business Manmath Nayak  August 16, 2023 10:19 AM IST ",Business
"Petrol Price Slashed by 49 Paise in Maharashtra: Check Fuel Rates in Delhi, Kolkata, Other Cities","

















 Business Manmath Nayak  August 16, 2023 10:19 AM IST ",Business
"RBI Launches UDGAM Portal To Track Unclaimed Deposits, Here Is How To Use It",,Business
"SBI Offers EMI, Interest Payment Relief For Borrowers From Violence-Hit Manipur",,Business
NCLAT To Hear IDBI Bank's Appeal In Zee Entertainment Insolvency Case On August 31,,Business
Rupee Dips 2 Paise To Close At All-Time Low Of 83.10 Against US Dollar,,Business
"Stock Market: Sensex Slips 388 Points, Nifty Below 19,400 On Weak Global Trends. PSU Banks Lead",,Business
ONGC To Invest Rs 1 Lakh Crore To Transform Into Low-Carbon Energy Player,,Business
CBDT Notifies New Guidelines For Tax Exemptions Under Section 10(10D) For High Premium Life Insurance Policy,,Business
India Plans To Import Wheat From Russia At Discounted Rate To Cool Prices: Reports,,Business
"World Bank Wants Employees Back In Office, Offers More Perks: Report",,Business
"Adani Power Shares Jump Over 3 Per Cent, Several Group Companies Trade In Green",,Business
Future Retail Resolution Professional Moves NCLT To Seek Extension Of Insolvency Deadline Till Sept 15,,Business
Coinbase Gains Regulatory Approval To Offer Crypto Futures To Eligible US Clients,,Business
"Stock Market: Sensex Falls 200 Points, Nifty At 19,400 On Weak Global Trends. Adani Power Rises 2 Per Cent",,Business
Foxconn Begins iPhone 15 Production In Tamil Nadu Plant: Report,,Business
"Cryptocurrency Price Today: Bitcoin Dips Under $29,000 As Reds Dominate Charts",,Business
"Nepal Requests Rice, Sugar Supplies From India To Avoid Possible Food Shortage In Festive Season",,Business
"Central Govt Employees In These States Will Get Salary, Pension In Advance. Check Details",,Business
Jute Industry Revenue Can Fall 5-6% Due To Weak Exports: CRISIL,,Business
Indian Banks' Lending To NBFCs Rise 35 Per Cent To Rs 14.2 Lakh Crore In June: Report,,Business
JU Student Death: Child Rights Panel Seeks Explanation Over Absence Of CCTVs In Hostel,,Business
'Maybe He Will Find Apes In...': Mehbooba Mufti Reacts To Azad's 'Indian Muslims Were Hindus' Comment,,Business
"Gujarat MLA Rivaba Jadeja Gets Into Verbal Spat With MP, Mayor Over 'Slippers’ — Watch",,Business
"'Fadnavis Didn't Return As CM, What Will Modi Return As,' Says Pawar, BJP Leader Hits Back",,Business
India’s Afghanistan Aid Reaches Record Levels. Time Now To Resume People-to-People Links,,Business
"Chhattisgarh Elections: BJP Releases First List Of 21 Candidates, Vijay Baghel Fielded Against CM Bhupesh",,Business
"Himachal Rains: IAF Completes Rescue Ops, Evacuates Over 1,000 People In 72 Hours. WATCH",,Business
"IndiGo Pilot Collapses, Dies At Airport Moments Before Flight's Take-Off, Third Case Of Sudden Death In A Week",,Business
Goa: 11 Schoolgirls Hospitalised After Classmates Use Pepper Spray As 'Mischief',,Business
'The Day Karan Johar Starts…’: Vivek Agnihotri On If He Will Ever Make A Romantic Movie,,Business
"Finance Minister Nirmala Sitharaman meets Governor of Japan Bank, seeks investments for India
 ","During the meeting with JBIC Governor Hayashi Nobumitsu in New Delhi, both exchanged views on JBIC's recent activities in India contributing towards Japan's venture focus of five trillion yen throughout the following five years.",Business
"Govt's push to logistics sector helps small cap stock to drive revenue, profit in June quarter
","According to a filing in BSE, the logistics solution provider clocked revenue of Rs 83.8 crore as compared to Rs 82 crore in the year-ago period. The total income soared to Rs 84.13 crore in the first quarter.
",Business
"Multibagger steel stock logs over 30% jump in revenue in June quarter amid firm domestic demand
",The revenue from operations came in at Rs 312.52 crore in the quarter as against Rs 240 crore reported in the corresponding quarter of the last year.,Business
"India's biggest food trade organisation posts eightfold rise in profit in Q1 on higher income
","HMA Agro is India's largest exporters of frozen buffalo meat products. Its equity shares got listed on exchanges (NSE and BSE) in July this year. 
",Business
"What is preferential issue & rights issue in stock market? Micro cap IT stock to raise over Rs 100cr
","In a preferential issue of shares, the participating company makes bulk allotment of fresh shares to its investors. The entire process is termed as the preferential allotment of shares.
",Business
"US-based GQG, other investors invest $1.1 billion for 8.1 per cent stake in Adani Power
",GQG Partners and other investors bought 31.2 crore shares of Adani Power in a block deal -- one of the largest-ever secondary market equity transactions. ,Business
"Aptech CEO Anil Pant passes away months after going on indefinite leave: Know all about him
","According to his LinkedIn page, Pant had taken over as MD and CEO of Aptech in July 2016. ",Business
"Go First cancels flights till August 18 due to operational reasons | DETAILS
 ","Go First update: On May 2, Go First cancelled its flights and filed for voluntary bankruptcy before the National Company Law Tribunal, alleging delays on the part of a US-based engine maker, Pratt & Whitney. ",Business
"Domestic air passenger traffic jumps 25 pc in July, IndiGo leads market with 63 pc share
 ","No-frills carrier IndiGo carried 76.75 lakh passengers, cornering a market share of 63.4 per cent during the reporting month.",Business
"Retail inflation jumps to 7.44% in July from 4.87%
 ","Previously, high inflation was recorded at 7.79 per cent in April 2022.",Business
"R Doraiswamy named as LIC's next managing director 
","The Financial Services Institutions Bureau (FSIB), the headhunter for directors of state-owned banks and financial institutions, in June had recommended the name of Doraiswamy as MD. ",Business
"Wholesale inflation remain in negative for fourth month in a row, stands at (-) 1.36 pc in July
 ",The wholesale price index (WPI) based inflation rate has been in the negative since April and was (-)4.12 per cent in June. In July last year it was 14.07 per cent.,Business
"Central debt increased by 174% between 2013-14 and 2022-23, external debt by 100%: Finance Ministry
 ","The government's external debt, which was 374,484 crore in 2013–14, will increase by 100% to 7,48,895 crore in 2022–23.",Business
"Stock split, bonus in 2023: Multibagger small cap aluminium stock reports stellar quarterly results
","According to a BSE filing by the company, it has reported over 6 per cent jump in total income in the first quarter (Q1FY24) at Rs 27.3 crore. The small cap's net profit also increased to Rs 1 crore in the quarter.
",Business
"Small cap logistics stock declares bonus shares issuance in quarterly results
","As per the SEBI directives, the bonus issuing company has to fix a record date when investors must own shares in order to be eligible to participate in corporate event. This is called record date.",Business
"NCCF sells 71,500 kg of tomatoes in Delhi in 2-day mega sale
","Out of 71,500 kg of tomatoes, 36,500 kg were sold on August 12, while 35,000 kg on August 13, it added. Tomatoes were sold at a subsidised rate of Rs 70 per kg.",Business
title,article,category
"FM Sitharaman addresses B20 Summit of Business leaders in New Delhi; Says, govt's priority is to check inflation
",Finance Minister Nirmala Sitharaman said that India has showcased an accelerated pace of economic reforms in the last nine years.,Business
"FM Sitharaman addresses B20 Summit of Business leaders in New Delhi; Says, govt's priority is to check inflation
",Finance Minister Nirmala Sitharaman said that India has showcased an accelerated pace of economic reforms in the last nine years.,Business
"Key domestic share indices witness losses of more than half a percent
",The key domestic share indices witnessed losses of more than half a percent on Friday.,Business
"Rice sowing area stood at over 384 lakh hectares
",The sowing area of rice and coarse cereals have increased under Kharif crops this year as compared to last year. ,Business
"India's Rising Prosperity: An In-Depth Discussion on Akashvani
","In a recent episode of Akashvani's program ""Spotlight,"" the spotlight was on India's remarkable progress towards equitable and collective prosperity. ",Business
"Gold prices today declined 50 rupees at Multi Commodity Exchange for October contracts
",Gold prices today declined 50 rupees at Multi Commodity Exchange for October contracts. ,Business
"Asian stock markets gained today
","Asian stock markets gained today after blockbuster results from tech giant Nvidia boosted Wall Street, while a retreat in government bond yields eased pressure on borrowing costs, further boosting sentiment.",Business
"U.S. stocks closed higher yesterday, Tech giant Nvidia jumped 8% in trading after the bell
","U.S. stocks closed higher yesterday, as tech giant Nvidia jumped 8 percent in trading after the bell, hitting an all-time high.",Business
"Forex market: Rupee closes at 82.58 against US dollar
","In the forex market, the rupee closed at 82 rupees and 58 paise against the US dollar.",Business
"Global stocks extend comeback rally, US benchmark Treasury yields touches a 16-year high
",Global stocks today extended their comeback rally. The US benchmark Treasury yields touched a 16-year high on concerns those interest rates could stay higher for longer and the safe-haven dollar nudged lower from recent 10-week highs.,Business
"Three major US share indices jumped as investors were optimistic amid gains in technology-related stocks gaining
",The three major US share indices jumped as investors were optimistic amid gains in technology-related stocks gaining. The Nasdaq ended more than one and a half percent higher yesterday.,Business
"G20 Summit Shines Spotlight on India's Digital Prowess and Global Leadership
","In a dynamic discussion on Akashvani's Spotlight program, economic analyst Sushma Ramachandran and anchor Lalima Aneja Dang delved into the significance and key priorities of the G20 Meeting on the Digital Economy, highlighting India's burgeoning digital prowess and global leadership.",Business
"Gold prices rise by three rupees, trades at Rs 58,378/ 10 gram
","Gold prices today rose by three rupees at Multi Commodity Exchange for October contracts. The precious metal was trading at 58,378 rupees per 10 grams.",Business
