Title,Article,Category
Ricky Kej releases instrumental version of India's National Anthem,"Three-time Grammy Award-winning Indian music composer Ricky Kej released an instrumental version of India's National Anthem 'Jana Gana Mana' to commemorate the 77th Independence Day of India. The one-minute-long clip of the National Anthem has also been lauded even by Prime Minister Narendra Modi. ""Wonderful. It will certainly make every Indian proud,"" PM Modi tweeted.",Entertainment
News channels went 'berserk' during coverage of Sushant Singh Rajput's death: SC,"The Supreme Court said the existing self-regulatory mechanism to monitor TV news channels needs to be made ""more effective"" and sought the Centre's response on it. A bench, led by CJI DY Chandrachud, commented that some channels went ""berserk"" during the coverage of actor Sushant Singh Rajput's death case. However, SC stressed it doesn't want to impose censorship on media. ",Entertainment
Alia said she'll hide outside Bigg Boss sets to hug Pooja: Mahesh,"In a message to his daughter-actress Pooja Bhatt, who was among the top five 'Bigg Boss OTT 2' contestants, filmmaker Mahesh Bhatt said that he feels like he is waiting for her outside her school. He also added that Alia Bhatt, half-sister of Pooja, said she will hide outside the sets to hug her after the show.",Entertainment
Aamir to produce supernatural love story for son Junaid: Report,"Actor Aamir Khan's son Junaid Khan will be doing a film with Aamir Khan Productions, a Pinkvilla report has said. According to the report, Junaid will be seen playing the role of an insurance investigator who falls in love with the spirit of a woman in a coma. The report also added that the pre-production of the movie has begun. ",Entertainment
Brotherhood will always remain: Elvish on equation with Abhishek,"Elvish Yadav, who was declared the winner of 'Bigg Boss OTT 2', has said that his brotherhood with runner-up Abhishek Malhan will remain intact. Elvish said this when he was asked if there were problems between the two and if their friendship was being affected. He refuted the rumours and said that their bond has, in fact, strengthened. ",Entertainment
"They're God, who're we: Vivek on 'The Vaccine..' clash with Salaar","Filmmaker Vivek Agnihotri has reacted to the clash between his film 'The Vaccine War' and actor Prabhas' 'Salaar' which will release on the same day. ""'Salaar' and we are poles apart,"" he said, adding, ""They are kings...they are God...they are demi-Gods. We are who? We are ordinary Indian citizens,"" Vivek further said. ",Entertainment
Troubled by negativity aimed at Sonam due to my comments: Rana Daggubati,"Actor Rana Daggubati apologised to Sonam Kapoor after she was criticised following his comments. Daggubati spoke about a ""big Bollywood actress"" wasting Dulquer Salmaan's time on sets by being ""engrossed in a conversation about shopping in London with her husband"". He said he is troubled by negativity aimed at Sonam and added his comments were meant in a light-hearted manner. ",Entertainment
"Hrithik, Deepika starrer Fighter's first look unveiled on I-Day","On 77th Independence Day, the first look of Siddharth Anand directorial 'Fighter', which stars Hrithik Roshan, Deepika Padukone and Anil Kapoor, was unveiled. The film will be released on the eve of India's 75th Republic Day. Sharing the post, Deepika wrote, ""A salute to our glorious nation. Happy Independence Day!"" The actors will be seen playing Air Force officers.",Entertainment
'Gadar 2' records biggest Monday collection in Bollywood as film earns ₹173 cr in 4 days,"Sunny Deol-starrer 'Gadar 2' has recorded the biggest Monday collection in Bollywood's history after earning around ₹39 crore, Box Office India reported. The film's total box office collection now stands at over ₹173 crore. The film also became highest grossing film of Sunny's career in just two days of its release.",Entertainment
World is round: Mahindra on video of Kej conducting UK orchestra,"Billionaire Anand Mahindra shared a video of three-time Grammy Award winning Indian music composer Ricky Kej conducting an orchestra performing India's National Anthem at London's Abbey Road Studios. ""The world is indeed round. Things come full circle. 76 years after wrestling our freedom from British, an Indian conducts their finest orchestra in a tribute to our Independence,"" Mahindra said.",Entertainment
Used to think 'What am I paying price for': Vahbiz on body-shaming,"Vahbiz Dorabjee said she was affected when she was body-shamed earlier. ""Because of some health issues, I started putting on some weight and I faced a lot of criticism...That phase was very difficult...My confidence [was] shattered...I'd break down and cry thinking, 'What am I paying this price for?' But when it kept on happening, it made me unbreakable,"" she added. ",Entertainment
Akshay Kumar gets Indian citizenship; shares pic of certificate,"Akshay Kumar took to Twitter to share his Indian citizenship certificate and wrote, ""Dil aur citizenship, dono Hindustani. Happy Independence Day! Jai Hind!"" The certificate mentions his previous nationality as Canadian. Reacting to the picture shared by the actor, several Twitter users congratulated him.",Entertainment
Ukrainian singer Uma Shanti throws Indian flags at crowd during Pune concert; FIR filed,Ukrainian singer Uma Shanti has been booked for insulting the Indian National Flag during a concert in Pune on Sunday night. A video showed her waving the flags before throwing them at the crowd during her performance with her band Shanti People. An FIR has also been launched against organiser Kartik Morein in the matter.,Entertainment
"No work is small, I cleaned toilets when I was in jail: Salman","Salman Khan said no work is small and revealed he cleaned toilets in boarding school and when he was in jail. He added that in past seasons of 'Bigg Boss', he had to enter the house and clean toilets. However, he also said that he had never seen washrooms inside 'Bigg Boss' house as clean as Pooja Bhatt kept them.",Entertainment
Wanted to be an IAS officer to serve my country: Raashii on I-Day,"On the 77th Independence Day, actress Raashii Khanna said that she wanted to become an IAS officer to serve the country. ""God's plans were better than mine because now...[as] an actor...I can be an IAS officer as well as a politician on-screen,"" she added. Raashii added that her favourite film on India's freedom struggle is 'The Legend of Bhagat Singh'.",Entertainment
Auditioned for 'Boogie...' to see SRK's house in Mumbai: Rajkummar,"Actor Rajkummar Rao has revealed that he had auditioned for the dance show 'Boogie Woogie' in childhood. ""I think for me it was an excuse to visit Bombay and just see my dream city...To visit Shah Rukh Khan's house, Mannat. I could see Bachchan sir's house and see some actors. I also wanted to see shoots happening,"" he added. ",Entertainment
"I'm Iranian, phir bhi dil hai Hindustani: Elnaaz Norouzi on I-Day","On India's 77th Independence Day, model-actress Elnaaz Norouzi said that she is Iranian, ""phir bhi dil hai Hindustani (but my heart is Indian)"". ""There is something Indian in me. I don't know what it is. But I feel like I belong here,"" she said. Elnaaz added that she understood the ""true meaning of freedom"" after staying in India.",Entertainment
Why did no one make films like Gadar for 22 years: Sunny Deol,"Actor Sunny Deol, who can be seen in 'Gadar 2', has said that the ""field has been empty"" for 22 years and asked why no one has made films like 'Gadar' in this time period. ""It would have been something else if such films were being made...the field was empty...So we came and did what we had to,"" he added.
",Entertainment
365 days too less to celebrate what we've as nation: Sara on I-Day,"On the 77th Independence Day of India, actress Sara Ali Khan said that ""365 days are too less to celebrate and be thankful and grateful for what we've as a country today"". ""It's not just one day,"" Sara said. ""It's not just the freedom fighters...it was a generation of sacrifice, bravery and constant endeavour,"" she added.",Entertainment
I'd take pride in making best flag in childhood: Gaurav on I-Day,"Actor Gaurav Chopra said he would make flags on Independence Day in his childhood and would take pride in making the best flag. ""As a child...it wasn't clear to me why one salutes the flag...As I grew up, I started to understand the world...politics and history. I understood that the [flag is an] amalgamation...of so many different things,"" he added.",Entertainment
"Elvish Yadav wins Bigg Boss OTT 2, gets ₹25 lakh cash prize","YouTuber Elvish Yadav has been named the winner of the reality show Bigg Boss OTT 2, hosted by actor Salman Khan. Along with the trophy, he also got ₹25 lakh cash prize. While Abhishek Malhan was named the runner-up of the show, Manisha Rani came third. Pooja Bhatt and Bebika Dhurve were also among the top five contestants.",Entertainment
Saw Ind-Pak & Ind-SL matches in same clothes: Abhishek on 2011 WC,"Abhishek Bachchan in an interview revealed that he watched India vs Pakistan and India vs Sri Lanka 2011 Cricket World Cup matches in the same clothes. Recalling the final match between India and Sri Lanka, he said, ""I just remember going completely nuts, running up and down the house. We went crazy and...it's a memory of a lifetime.""
",Entertainment
"Dharmendra reacts as Esha poses with Sunny, Bobby","Veteran actor Dharmendra, taking to Twitter, shared a video from the special screening of 'Gadar 2' which was organised by Esha Deol. In the video, the actress was seen posing with Sunny Deol and Bobby Deol. Dharmendra captioned the video, ""Togetherness a great blessing."" Esha arranged the screening on Saturday. 
",Entertainment
"Saiyami howled during a 'Ghoomer' scene, Shabana got scared: Balki","Director R Balki spoke about a scene in 'Ghoomer' where Saiyami Kher had to break down. ""She listened to some song...[came] and howled...[Shabana Azmi] was so kind of amazed by [her] ability to crack up like that...She was so scared to even go talk to her,"" Balki recalled. He said he felt moved by Saiyami's performance during that scene. ",Entertainment
Satish Kaushik was one of the finest storytellers I met: Rajkummar,"Rajkummar Rao called late actor-filmmaker Satish Kaushik ""one of the finest storytellers"". ""If you are with him at a party, you don't need anybody else, you don't need any music, just ask him about one film and he'll tell you such amazing fascinating stories,"" he added. Satish passed away earlier this year.
",Entertainment
Saiyami had 50 scars on hand during a scene in Ghoomer: Abhishek,"Abhishek Bachchan said Saiyami Kher had 50 scars on her forearm during a scene of 'Ghoomer' and she didn't make a big deal about it. ""We didn't even know. [R Balki] pointed it out on third day that her forearm was cut...The one thing I hope is that people recognise her talent and give her the due credit,"" Bachchan shared. 
",Entertainment
Even adult stars deserve respect: Nikki on being called porn star ,"Actress Nikki Tamboli, reacting to being called 'porn star' by trolls on social media, said, ""Comparing me or anyone else to an adult film star is an insult to those ladies."" ""Why demean a woman at the cost of another woman for no reason?"" she added. ""Even an adult film star deserves respect on a humanitarian level,"" Nikki further said.
 ",Entertainment
Was hesitant: Sunny Deol on recreating hand-pump scene in Gadar 2,"Actor Sunny Deol, while talking about the hand-pump scene in 'Gadar 2', spoke about how he's usually hesitant about recreating something he has already done in the past. ""But the way [Anil Sharma] explained the sequence was very interesting...we knew what we were doing...the hand-pump [scene] is so iconic...that's the only thing that pops up in [people's] mind,"" Sunny shared.",Entertainment
"Was told not to work with Suniel, want to apologise to him: Somy","Somy Ali spoke about how she was told to not do a film with Suniel Shetty. ""[I was told] I should work only with big actors. I just want to say that whatever decision I took, it was based on the guidance I got,"" she told Bollywood Thikana. She said she'd like to apologise to Suniel for her previous remarks.",Entertainment
Had no idea: Sunny on 'Udja Kale Kawan' reference in 'OMG 2' ,"Sunny Deol reacted to 'Gadar' song Udja Kale Kawan's reference in Akshay Kumar's 'OMG 2'. ""I have not seen the film, so I had no idea,"" he said, adding that he hasn't even seen 'Gadar 2' properly. In 'OMG 2', Akshay, who plays Lord Shiva's messenger, is seen lying under a tree and singing the lyrics of 'Udja Kale Kawan'. ",Entertainment
16-year-old actor Aarush starts online petition for removal of 'A' certificate from 'OMG 2',"OMG 2's 16-year-old actor Aarush Varma has started an online petition for removal of 'A' certificate from 'OMG 2'. ""It is a film meant for children my age and also parents who are uncomfortable talking about sex education. This film could have been an eye opener. Being a 16-year-old I know the issues we face,"" he wrote.",Entertainment
Ambedkar's grandson reacts to Dalit woman's role in Made in Heaven 2,"BR Ambedkar's grandson and Dalit activist Prakash Ambedkar said he ""absolutely loved the assertion, defiance and resistance of...Dalit woman character"" in 'Made in Heaven 2'. ""For those Vanchits and Bahujans who've watched the episode - Assert your identity and only then you gain political prominence. As Pallavi (role of Radhika Apte) puts it, 'Everything is about...politics',"" he wrote on X.",Entertainment
"Was crying, told dad 'I'm not drunk': Deol on 'Gadar 2' success  ","Actor Sunny Deol in an interview spoke about how stressed he was before the release of 'Gadar 2'. ""When the film opened, I felt God within me,"" he added. ""The entire evening, I kept crying, laughing. I met my father and told him, 'Dad I'm not drunk! But I'm happy, I've gone mad with happiness',"" Sunny further said.
 ",Entertainment
You'll be missed: Ankita shares first post after father's death ,"Actress Ankita Lokhande has shared her first post after the demise of her father Shashikant Lokhande. In an Instagram Story, she shared a card about her father's prayer meet. It read, ""Prayer meet. You will be missed forever, Shashikant Lokhande."" He passed away on August 12 at the age of 68.  ",Entertainment
"Kartik performs 'Pyaar Ka...' monologue at IFFM, video surfaces","A video of Kartik Aaryan from Indian Film Festival of Melbourne (IFFM) surfaced on internet in which he's seen recreating Pyaar Ka Punchnama's monologue. Kartik was honoured with 'Rising Global Superstar of Indian Cinema' award. On Instagram, Kartik shared a video and wrote, ""[The award] brings a lot more responsibility to do better...This award belongs to all my fans...well wishers.""",Entertainment
Rajinikanth's 'Jailer' grosses ₹300 cr worldwide in 4 days ,"Rajinikanth-starrer 'Jailer' has grossed ₹300 crore at the global box office in four days of its release. As per Sacnilk.com report, the total box office collection of the action-comedy film now stands at around ₹146.4 crore nett in India in all languages. The Nelson Dilipkumar directorial released in Tamil, Hindi, Telugu, Malayalam and Kannada.
 ",Entertainment
"Sanjay Dutt gets injured while shooting sword-fighting scene, gets stitches on head: Report","Actor Sanjay Dutt got injured while shooting for Puri Jagannadh's 'Double Ismart'. The actor suffered injuries while shooting a sword-fighting scene, a report said, adding that he got a couple of stitches on his head. Sanjay, however, got back on the set after getting treatment and resumed shooting.",Entertainment
'Gadar 2' becomes Sunny Deol's first-ever film to cross ₹100-crore mark,"'Gadar 2' has become actor Sunny Deol's first-ever film to cross ₹100-crore mark at box office in India. The film crossed the mark within three days of its release and has collected ₹134.88 crore till Sunday. 'Gadar 2' is also the highest-grossing movie of Sunny's career. 'Gadar: Ek Prem Katha', which earned around ₹76.88 crore, was Sunny's previous highest-grossing movie.",Entertainment
"Gadar was actually Ramayan, had remarked 'It won't flop': Director","Director Anil Sharma shared that 'Gadar' ""was actually Ramayan"" and he had remarked back then that the film had no chance to fail at the box office. About 'Gadar 2', the filmmaker revealed he was sure that it won't fail as it is inspired from Mahabharat. Sharma further shared that he cried after listening to the story of the sequel. ",Entertainment
"Genelia remembers Vilasrao on death anniversary, shares old pic ","Actress Genelia Deshmukh remembered Vilasrao Deshmukh on his death anniversary on Monday. Sharing a picture from her and Riteish Deshmukh's wedding, she wrote, ""Dearest Pappa, I just want you to know you are so wonderful to think of, but so so so hard to live without."" ""We miss you Pappa...Until we meet again,"" added Genelia. 
",Entertainment
Was emotional to see Amrish Puri's CGI version in Gadar 2: Vardhan,"Amrish Puri's grandson Vardhan Puri said that the CGI version of the actor in 'Gadar 2' ""made every Indian emotional"". ""The respect the team and every Indian has shown to my grandfather's soul during the making of the film...and [its] release is overwhelming,"" he shared. ""Sunny [Deol] and Anil Sharma expressed their gratitude towards [my grandfather]...that made...my family...proud,"" he added.",Entertainment
I'm completely heartbroken: Dwayne Johnson on Maui wildfires,"Actor Dwayne Johnson has said that he is ""completely heartbroken"" over raging wildfires in Maui. ""Everything that I've seen transpire over these past couple of days, everything that continues to transpire hour by hour, minute by minute, it's all heartbreaking,"" Dwayne added. He also said that he has been speaking with organisations on the ground.",Entertainment
Didn't see my father growing up for weeks: Abhishek Bachchan  ,"Abhishek Bachchan, in an interview with Humans of Bombay, opened up about his father Amitabh Bachchan's dedication towards his work. ""When I was growing up, there were weeks on end when I wouldn't see my father...he used to leave for work before I woke up in the morning, and he'd come back after I'd gone to bed,"" Abhishek said. 
 ",Entertainment
"John is kind & sorted, doesn't take advantage of women: Kangana","Actress Kangana Ranaut has praised actor John Abraham for being ""kind and sorted"". ""[He has] no marriage or relationship PR, no paid negativity for others, no harassment or taking advantage of women, no agenda or groupism...[He is] simply a wonderful man. Love you John,"" the 'Queen' actress wrote on her Instagram Stories. ",Entertainment
"Told father I'm playing gay in 'Taali', he wasn't shocked: Ankur","Actor Ankur Bhatia will be seen playing a gay activist in Sushmita Sen-starrer 'Taali'. ""To play [the role], I shaved for the first time in [10-11 years]...also interacted with a couple of my [gay] friends,"" Ankur shared. He added, ""The minute I signed [the project]...I told my dad...I realised that he didn't have a shock value to it.""",Entertainment
Dancer Shirley Ballas skydives to raise money for suicide charity,"Dancer Shirley Ballas completed a skydive to raise money for a suicide prevention charity. Ballas jumped out of a plane more than 13,000 feet over Sibson Airfield in Peterborough. She had ""for David"" written on her hands in memory of her brother. Ballas said the skydive was the most ""terrifying"" and ""exhilarating"" thing she's ever done.",Entertainment
"Was paid ₹11,000 for my first film: Rajkummar Rao","Rajkummar Rao in a recent interview revealed that he was paid ₹11,000 for his first film. The actor, who debuted with 'LSD: Love, Sex Aur Dhokha', added that he wants to do only good work and collaborate with like-minded people. On the work front, Rajkummar will next be seen in 'Guns & Gulaabs', 'Mr. & Mrs. Mahi' and 'Stree 2'.",Entertainment
"Dilip waited for Big B post Black's premiere, held his hand: Saira","Saira Banu said Dilip Kumar and Amitabh Bachchan shared ""a mutual admiration"" for each other. She recalled that after Black's premiere, Dilip waited for Amitabh outside the theatre. ""[He] walked up to him, held his hands...Amitabh [said] 'I didn't speak a word...[Dilip's] eyes spoke the most eloquent words that anyone ever spoke to me',"" Saira wrote on Instagram. ",Entertainment
"Insta user tells Smriti about mom's demise in Q&A, she responds","Union Minister Smriti Irani conducted a Question and Answer session with her followers on Instagram. One of her followers said, ""My mumma was your biggest fan. Last month she passed away. Whenever I see you, I miss my mum."" Responding to this, Irani said, ""I'm sorry for your loss...I speak of her in the present because she lives in you.""",Entertainment
"Sridevi shot 'Kate Nahin...' in high fever, numbing pain: Shekhar ","Shekhar Kapur, remembering Sridevi on her birth anniversary, revealed on Instagram that the actress shot song 'Kate Nahin Kat Te' in ""high fever"" and ""numbing pain"". He added that he got to know from choreographer Saroj Khan that Sridevi was unwell only after the shoot was finished. ""You made her swear she wouldn't tell me,"" Shekhar wrote, referring to Sridevi.
 ",Entertainment
Honour undying hope that birthed India: US singer ahead of I-Day,"US singer Mary Millben extended warm greetings to India ahead of the country's 77th Independence Day on Tuesday. ""You are not just commemorating a date...you are honouring the relentless spirit...and the undying hope that birthed a nation,"" Millben said in a statement. Notably, Millben performed the national anthem for PM Narendra Modi during his recent state visit to the US.",Entertainment
Vijay asked 'Our friendship is nothing?': Nelson on Beast failure,"Filmmaker Nelson Dilipkumar revealed that he asked actor Vijay if he was upset with him after 'Beast' received mixed reviews. ""He looked perplexed...asked, 'Why would I be pissed with you?'...[He] asked, 'So, our friendship is nothing...is it? You've hurt me by asking this',"" the filmmaker told Galatta. Nelson added that Vijay expressed that he's happy about Jailer's success. ",Entertainment
"Created characters out of brushes, bottles: Dolly on acting dream","Dolly Singh spoke about her dream of becoming an actor since childhood. ""I would create characters out of toothbrushes and shampoo bottles...in my bathroom and then talk to them and make them...talk to each other in my voice...I've done all those crazy things that kids do. After therapy, I realised...the acting bug was always there in my head,"" she added.",Entertainment
Sunny Deol steps back after fan tries to touch his arm for selfie; video surfaces,"Actor Sunny Deol stepped back after a fan tried to touch his arm while taking a selfie in Mumbai. A video of the incident showed the actor being surrounded by his security personnel when a girl tried to touch his arm for a selfie, to which the actor asked her to remain quiet by putting a finger on his lips. ",Entertainment
"I was asked to change my name, make it sound 'more Indian': Elnaaz","Model-actor Elnaaz Norouzi revealed she was asked to change her name and make it sound ""more Indian"". ""I was first seen as a foreign model and people laughed at me. I had to prove to everyone that I speak Hindi and I can read and write Hindi. I took so many years to prove that I can act,"" she added. ",Entertainment
"Dulquer was in a corner, actress was on phone; I got angry: Rana","Rana Daggubati recalled visiting Dulquer Salmaan on a Hindi film's set. ""He was standing in a corner...a big Hindi heroine who was doing that movie was engrossed in a phone conversation about shopping...Her lack of focus affected the shots' quality,"" Rana shared. He said that while Dulquer was ""patient"", he couldn't control his anger and had a word with producers.",Entertainment
August 11 to 13 weekend breaks all-time box office record in India,"The Producers Guild of India and Multiplex Association of India, in a joint statement, stated that the August 11 to 13 weekend broke the all-time box office record in India. As per the statement, 'Jailer', 'Gadar 2', 'OMG 2' and 'Bhola Shankar' set the all-time combined weekend theatrical gross box office record with collection of more than ₹390 crore.",Entertainment
"Priyanka gets emotional during Nick Jonas' concert, video surfaces","Actress Priyanka Chopra got emotional during her singer-husband Nick Jonas' concert. A video showing Priyanka wiping off tears during the concert has surfaced online. In the video, the camera first pans at Chopra and then at two big screens where Nick can be seen performing. Several people can be seen dancing around Priyanka.",Entertainment
I wish I had courage at start of my career: Huma on body shaming,"Actress Huma Qureshi said that she does think that her film 'Double XL' was a ""cathartic experience"" for her in connection with being body shamed in the industry. ""I wish I had this courage and clarity when I started my career. People were really being obnoxious and I think obnoxious things need to be called out,"" she added. ",Entertainment
There were animals with Akshay in water scene: Designer on 'OMG 2',"'OMG 2' costume designer Leepakshi Ellawadi has revealed that during a scene in 'OMG 2' when actor Akshay Kumar emerged from water, there were many animals alongside him. ""But he was focused on the scene and called for multiple shots,"" she added. She also spoke about styling Kumar in the movie using dhotis, wigs and more. ",Entertainment
