Title,Article,Category
I've just come out but I'd consider it: Avinash on Bigg Boss 17,"When asked if he wants to be a part of 'Bigg Boss 17', actor Avinash Sachdev laughed and said he has just come out of the 'Bigg Boss OTT2' house. He then said that he would consider it. He further said that it will depend on what all options he has at the time and he is open to anything.",Entertainment
 Why didn't she say it before: Avinash on Palak's infidelity blame,"Actor Avinash Sachdev has reacted to Palak Purswani's accusations of infidelity and said that it is a very serious blame. He also said that if that was the case, why did Palak not say anything in her previous interviews after their breakup? He claimed that the two met at birthday parties and that her behaviour was completely normal towards him.",Entertainment
Salman made a mess of it: Mulshi Pattern actor on its remake Antim,"Salman Khan-starrer 'Antim: The Final Truth' was the remake of Marathi film 'Mulshi Pattern'. The film's actor Upendra Limaye revealed on a chat show that Salman ""took his collar up and kept saying, 'What a film'"" when he saw 'Mulshi Pattern' but ""made...mess of it"" in the remake. Director Pravin Tarde revealed he didn't and won't watch Salman's film.",Entertainment
I play 'Koi...Mil Gaya' title song to put my kids to sleep: Preity,"Actress Preity Zinta, who played Nisha in 'Koi...Mil Gaya', said that she plays the title song of the movie to put her kids Gia and Jai to sleep. Preity added, ""It helps calm them down."" She also described her children as 'jadoo' (magic), while referring to the film's extraterrestrial character. 'Koi...Mil Gaya' recently completed 20 years of its release.",Entertainment
A 27-yr-old woman is playing a 12-yr-old role in 'Taali': Sushmita,"Sushmita Sen shared that her upcoming series 'Taali', which is a biopic on trans activist Shreegauri Sawant, will feature a 27-year-old ""married woman"" in the role of a 12-year-old version of Shreegauri. The actress said the series breaks the old casting norms and promotes the idea to let the best man, woman or transgender play the role they fit.",Entertainment
Will remember you: Kareena on Bodyguard director Siddique's demise,"Actress Kareena Kapoor took to her Instagram Stories to condole the demise of director Siddique Ismail, who passed away aged 63 on Tuesday. Kareena, who worked in his directorial 'Bodyguard', wrote, ""Will always remember you like this...with a smile. You will be missed Siddique sir."" Siddique had suffered a heart attack on Monday and his condition was critical.",Entertainment
Hrithik looked unrecognizable as Rohit: Preity on 'Koi Mil Gaya',"Preity Zinta said she was irritated with Hrithik Roshan for being late on first day of 'Koi Mil Gaya' shoot. ""Suddenly someone tapped on my shoulder...I turned to see and it was Hrithik in Rohit's look...He was completely unrecognisable...It only then struck me that Hrithik was on set all along...it was just that I did not recognise him,"" she added.",Entertainment
Couldn't express myself: Jad on language barrier in 'Bigg Boss..',"Jad Hadid has spoken about the language barrier that he had with other contestants inside the 'Bigg Boss OTT 2' house. Jad said that he couldn't connect to so many conversations inside the house. He also said that he could not fully express himself. ""That's why I was somehow impulsive in situations,"" Jad added. ",Entertainment
"Yes, my mother was born in UK: Alia on if she's a British citizen","Alia Bhatt was recently asked if she is a British citizen. ""Yes. My mom was born in Birmingham, but I was born and brought up in India,"" she replied in a video for Wired. Alia, who was accompanied by Gal Gadot, further said her grandmother lived in England for her whole life. ""My grandmother has the English accent,"" she added. ",Entertainment
"Pic from Bigg Boss OTT 2 shows mobile next to Pooja, people react","A picture from 'Bigg Boss OTT 2', which has surfaced on internet, shows a mobile phone next to Pooja Bhatt. The viral picture received reactions from people. ""Now you got...proof, this is Bigg Boss' truth,"" a comment read, while another social media user recalled how Pooja's co-contestant Elvish Yadav was right about her having access to mobile in the show.",Entertainment
"Sadhguru backs Akshay Kumar's 'OMG 2' amid controversy, questions 'A' certificate","Following his praise for Akshay Kumar's upcoming film 'Oh My God 2', Sadhguru has responded to the movie's 'A' certificate from Censor Board. ""A Certificate in this case should include Adolescents...Education about...human biology and responding to...biological needs of an individual in a dignified and responsible way is very needed,"" he wrote. The film deals with sex education in Indian schools. ",Entertainment
Nobody wanted to join hands with us: Sunny on launching Bobby,"Sunny Deol spoke about the time when his actor-brother Bobby Deol had to be launched in industry. ""I remember going to all the directors even when I was launching Bobby...nobody was willing to join hands with us,"" Sunny recalled. ""Everybody comes and hugs you and meets you like they...love you so much but all of that is fake,"" he added.",Entertainment
"Priyanka was brave, don't think I can do it: Alia on moving to US","When asked if she will move to US like Priyanka Chopra, Alia Bhatt said, ""I think what Priyanka did was extremely brave and very different from what anyone has ever done."" ""I don't think I could do that. I want to continue to do movies in India,"" she added. Alia will be making her Hollywood debut in 'Heart of Stone'.",Entertainment
"Army supported us a lot, we blew up real bridges: Gadar 2 maker","'Gadar 2' director Anil Sharma said that the Army supported them during the making of the film. ""They gave us tanks, locations [and] soldiers,"" he added. ""We shot in UP, we got a lot of help from the ministry there...We used to block main roads, we blew up real bridges,"" Sharma further said, while speaking about the film's shoot. ",Entertainment
Sunny compromised on fees when stars charge ₹200 cr: Gadar 2 maker,"'Gadar 2' director Anil Sharma said that actor Sunny Deol ""compromised quite a bit"" on his fees for the film. ""These days, heroes and directors charge so much, the budgets end up ballooning up to ₹600 crore, and sometimes the heroes charge...₹200 crore,"" Anil said. He denied reports suggesting the film cost between ₹75 crore and ₹100 crore to produce.",Entertainment
SRK tutored Alia to lip sync for 'Rocky Aur...' for 6 hrs: Karan,Filmmaker Karan Johar said that actor Shah Rukh Khan tutored actress Alia Bhatt to lip sync for a song in 'Rocky Aur Rani Kii Prem Kahaani' for six hours. He also revealed that Khan also taught his daughter Suhana along with Alia. Karan said that Shah Rukh Khan mastered the art of lip sync a while ago.,Entertainment
Ranveer Singh replaces Shah Rukh Khan in 'Don 3'; 1st look revealed,"Ranveer Singh will replace Shah Rukh Khan in 'Don 3' as the actor's first look was revealed in a teaser released by Excel Entertainment. Earlier, Farhan Akhtar had teased the announcement of 'Don 3' and confirmed that Shah Rukh Khan won't reprise his role. Reacting to the announcement many social media users said, ""Don is incomplete without SRK.""",Entertainment
"Ileana shares pic with son, says '1 week of being your Mama'","Actress Ileana D'Cruz, who welcomed her son Koa Phoenix Dolan on August 1, shared a new picture with him. Taking to Instagram Stories on Wednesday, Ileana posted a monochrome photo wherein Koa Phoenix held her finger as she held his hand. Ileana wrote, ""1 week of being your Mama."" Ileana reportedly welcomed her son with partner Michael Dolan.",Entertainment
" Tried 'trendy steps', video was shared on family group: Twinkle","Twinkle Khanna said that she once tried improving her ""rusty"" steps with a video that said ""trendy dance steps"". ""Then I started trying to replicate those steps and everyone in my house saw me,"" she added. ""Somebody took a video and it was all over the family group chat,"" the actress-turned-author further said. ",Entertainment
Told Rekha I'd marry her if I was older: Koi Mil Gaya child actor,"'Koi Mil Gaya' child actor Anuj Sharmma, who played the role of sardar child in the film, said that he once told actress Rekha that he would have married her if he was older. ""She started laughing,"" Anuj added. ""I was in love with that woman. It was amazing working with her,"" the actor further said about his co-star Rekha. ",Entertainment
Rapper Tory Lanez jailed for 10 years for shooting female rapper Megan Thee Stallion,"Rapper Tory Lanez has been sentenced to 10 years in prison for shooting fellow artist Megan Thee Stallion in 2020. Lanez was found guilty in December 2022 of three felonies related to the shooting, which left Megan injured in the foot. ""Since I was viciously shot by the defendant, I have not experienced a single day of peace,"" Megan said.",Entertainment
"Gadar 2 actress talks about depression, says 'locked myself up'","'Gadar 2' actress Simratt Kaur has spoken about a depressive episode she suffered in 2019. ""I felt like a failure, that I couldn't do anything in my career...I thought I am not good enough to be an actor...I went through a depressive mode, locked myself up for months. I stopped talking to everyone, cried [for] days and days,"" she added.",Entertainment
Kim Kardashian reveals she broke her shoulder & tore her tendon,"American media personality Kim Kardashian took to her Instagram Story to reveal that she recently broke her shoulder and tore the tendon. Kim added that due to the injury she was out of gym for a few weeks. She's currently in rehab with her trainer, Melissa Alcantara, who suffered a similar injury in the past. ",Entertainment
People ask why's there horrible media perception about me: Kangana,"Actress Kangana Ranaut said that people who work with her ask her why is there a horrible media-made perception about her. ""[They say] 'You are the most professional and amazing actor/director/artist we ever worked with'. This one thing I hear (on) a daily basis from every single person that I meet or work with,"" the actress added.",Entertainment
It took toll on my mom: Karan on getting hate comments from people,"Filmmaker Karan Johar spoke about getting hateful comments from people in the last three years and revealed that it took a toll on his mother. ""I saw her literally crumble under that because she used to watch TV channels. She was reading stuff online. She was quite like that in the zones,"" Karan added.",Entertainment
"Shiney Ahuja, convicted for raping maid, allowed to get passport renewed for 10 years","Bombay HC has directed passport authorities to not reject Shiney Ahuja's plea for passport renewal over his pending appeal against rape conviction if he's otherwise eligible. Ahuja, granted bail in 2011 in his maid's rape case, moved court for 10-year passport renewal. Court had given him bail in the trial court conviction which sentenced him to 7 years in jail.




",Entertainment
"Contrary to public opinion, my mother is not strict: Abhishek ","Actor Abhishek Bachchan, when asked about his mother Jaya Bachchan's nature, said, ""Contrary to public opinion, my mother is not strict."" ""She's the one you go running to when you're hurt as a kid,"" he added. ""Your mother is 'maa', and I've always said that the word 'maa' encapsulates pure love,"" Abhishek further said. ",Entertainment
"Never dated Shafaq, was going through breakup with Rubina: Avinash","Avinash Sachdev, while addressing rumour of dating Shafaq Naaz, said that if he'd dated the actress, the news would have been out as he ""had just wrapped up 'Choti Bahu' and was going through a breakup with Rubina Dilaik"". ""There [was] nothing like this...If anything like this would have [happened]...it would've spread on a bigger level,"" he told TOI.
",Entertainment
People in B'wood show they love you but it's all fake: Sunny Deol ,"Sunny Deol, in a chat with Puja Talwar, spoke about the pretentious nature of many in the film industry and said, ""Everybody comes and hugs you...like they love you so much but...that's fake."" ""So many people call me paaji, I say please don't call me paaji because you don't understand the meaning of paaji. There's...respect for older brother,"" added Sunny. ",Entertainment
"Told Ranbir, 'Wonder Woman made me coffee': Alia on Gal Gadot","Actress Alia Bhatt shared her first impression of her 'Heart of Stone' co-star Gal Gadot. ""She asked us if we wanted coffee...I was expecting someone to walk in with coffee but she went and...made the coffee herself in her trailer,"" she said. Alia added she called her husband-actor Ranbir Kapoor and told him that ""Wonder Woman made [her] coffee"". ",Entertainment
"If he plays dead man, will he die? Mahesh on Randeep's weight loss","Mahesh Manjrekar criticised Randeep Hooda's weight loss for 'Swantantrya Veer Savarkar'. ""Who told you to lose so much weight?... If he has to play a dead man, will he be dead? What rubbish...Nobody forced you to do it,"" he shared. Mahesh added that he gives ""100 out of 100 to Randeep"" for his sincerity but his ""obsession killed the film"".",Entertainment
'Bodyguard' director Siddique passes away after suffering heart attack,"Director Siddique Ismail, who made Bollywood film 'Bodyguard', passed away on Tuesday at the age of 63. Ismail had suffered a heart attack on Monday (August 7) and his condition was said to be critical. Ismail was one of the most celebrated Malayalam directors of all time, having made iconic films like 'Godfather' and 'In Harihar Nagar', etc.",Entertainment
Aryan Khan turns down ₹120 crore for his web series & SRK's offer to appear in it: Reports,"Shah Rukh Khan's son Aryan Khan has rejected an offer of ₹120 crore by an OTT platform for his web series, which will mark his directorial debut, as per reports. He reportedly won't sell it until he's ready with the finished product, including post-production editing, reports said. Further, he also reportedly turned down Shah Rukh's offer to appear in it.",Entertainment
TV host Wayne Brady comes out as pansexual,"US TV host and comedian Wayne Brady has come out as pansexual. ""I've come to see a few truths, one of them being that I want to be free to love whomever I want. This truth makes me Pan and part of the LGBTQ+ family,"" he wrote on Instagram. He has a 20-year-old daughter with his former wife Mandie Taketa.",Entertainment
"Report says Kangana was worried after film with Deol, she reacts","Kangana Ranaut reacted to a report claiming that she was worried about her career after film 'I Love New York' with Sunny Deol. ""I never said such a thing. I'm [his] big fan,"" she said and added that 'Gadar 2' ""will be biggest opener of the year"". Kangana expressed no other actress faces this kind of negativity on daily basis.",Entertainment
Everyone's scared to make sci-fi & children films: Hrithik,"Hrithik Roshan in an interview called himself a ""science-fiction buff"" and added that he keeps pushing everyone to make science-fiction and children films but they are scared to do so. ""I think, you can take any story and create a sci-fi film,"" he added. On the work front, Hrithik will next be seen in 'Fighter'.
",Entertainment
"Tanushree takes dip in Ganga, reacts to fans' concern on pollution","Tanushree Dutta, on Monday, shared videos where she was seen taking a dip in Ganga river at Manikarnika Ghat in Varanasi. Several users expressed concern over the level of pollution in the river, with one writing, ""Dead bodies are found at Manikarnika Ghat...Why did you take...bath there?"" ""It doesn't matter, I took...shower after I returned to my room,"" wrote Tanushree.",Entertainment
"16 phones stolen during Sunny, Ameesha's 'Gadar 2' promotions in Ghaziabad: Report","As many as 16 mobile phones were reportedly stolen during the promotional event of the upcoming film 'Gadar 2' in Ghaziabad, Uttar Pradesh. The film's actors Sunny Deol and Ameesha Patel had promoted their film in Ghaziabad on Sunday and the event witnessed a massive crowd. An investigation has been launched in the case by the local police, said reports.

",Entertainment
Had problem in catering to egos: Sushmita on break from Bollywood,"Sushmita Sen said she decided to take a break from films because she wasn't growing as a person and wasn't enjoying her work. ""[In the 90s] actresses had one song...breakdown scenes...that's [the] math used to be...I tired very quickly...had big problem catering to egos,"" Sushmita shared. ""When I came back...it was to say I wouldn't settle for less,"" she added. 
",Entertainment
"Akshay agreed to do 'Singh...' without reading script, says Anees ","'Singh is Kinng' director Anees Bazmee revealed that Akshay Kumar agreed to be a part of the film without even reading the script. ""Akshay was shooting...in a different country...So I called him, shared the idea and within five minutes, he was on board,"" he added. ""After that, Akshay got so busy...that we could never narrate...whole script to him,"" said Anees. ",Entertainment
"We were clicked topless, told to pose with legs open: Miss Universe Indonesia contestants","Six contestants of Miss Universe Indonesia pageant filed police complaints accusing organisers of sexual harassment. The Indonesian contestants said organisers asked five of them to strip to their underwear for physical examinations in a room with over 20 people, including men and then they were photographed topless. One of them alleged she was asked to pose by opening her legs.

",Entertainment
Met death row inmates in jail with Manoj Kumar: Prem on 'Shaheed',"Actor Prem Chopra recalled shooting 'Shaheed' with Manoj Kumar at an actual prison. ""We went to death row, where they told us that certain prisoners were to be hanged. The next day, when we asked where some of them were, they said that they were dead,"" the actor shared. ""We shot in the same cells,"" he added.",Entertainment
Realised Irrfan's work meant more to me than I knew: Gulshan,"Gulshan Devaiah, while speaking about late actor Irrfan Khan, said, ""I realised Irrfan's work meant a lot more to me than I knew when he died."" ""It's a bit more emotional because that loss is still there somewhere inside me,"" he added. ""You don't know until somebody is gone how important their work was,"" Gulshan further said. 
",Entertainment
"Turned out quite poor, I apologise: Nassar on Mohanlal's Pop Carn","Actor-filmmaker Nassar apologised for 'Pop Carn', which starred Mohanlal in the lead role. ""[It] turned out to be quite poor,"" he said in an interview with Mathrubhumi. ""Mohanlal is someone who consistently aims to understand his co-actors...Collaborating with him allows you to perform without any mental strain or concerns,"" he added. Nassar will be next seen in 'The Jengaburu Curse'. ",Entertainment
"Beyoncé pays $100,000 to extend DC metro train hours after rain delays concert","Singer Beyoncé paid $100,000 (over ₹82 lakh) to keep 98 metro stations in Washington, DC running for an extra hour. This came after her concert experienced a significant delay due to heavy rain and lightning. ""All fans inside of the stadium are asked to shelter in place under covered concourse areas and ramps until further notice,"" stadium authorities earlier stated.",Entertainment
Exited 'Swatantrya Veer...' due to Randeep's interference: Mahesh,"Mahesh Manjrekar, who was roped in to direct 'Swatantrya Veer Savarkar', revealed that he exited the project due to Randeep Hooda's interference. ""He wanted to incorporate a scene of Bhagat Singh with Savarkar. I was appalled. Where did this happen?"" he added. Mahesh said Randeep ""got too involved"", adding that his ""obsession killed the film"" for him.  
 ",Entertainment
I get upset when I see actors' obsession with 6-pack abs: Abhishek,"Actor Abhishek Bachchan shared that it upsets him when he sees actors getting obsessed with six-pack abs. ""Young actors these days believe they can become actors just by getting six-pack abs. Bro, focus on your language, work on your acting skills. That is what makes actors, not (well-built) bodies,"" the actor shared. Abhishek will be seen in 'Ghoomer'. ",Entertainment
We were having fun: Neil on saying 'shut up' to SRK at award show ,"Neil Nitin Mukesh, speaking to Siddharth Kannan, spoke about the time when he asked Shah Rukh Khan to ""shut up"" when the latter asked him about his surname at award function. He said they were ""having fun"" with each other. ""[He said]...I'll have fun...with you, you do your...thing,"" Neil said, adding after the incident, SRK told him, ""You did well."" ",Entertainment
"'Don 3' announced with new actor replacing Shah Rukh Khan, people react","Farhan Akhtar has teased the announcement of 'Don 3' and confirmed that Shah Rukh Khan won't reprise his role. ""Joining us in this new interpretation will be an actor whose talent and versatility I have long admired,"" Farhan wrote. Reacting to it, an Instagram user wrote, ""No SRK No Don. Period"" while another comment read, ""Don is incomplete without SRK!!!!""






",Entertainment
Dilip had refused to be cast as Nargis' son in Mother India: Saira,"Saira Banu shared that Dilip Kumar had refused to play Nargis' son in 'Mother India' and the role eventually went to Sunil Dutt. The actress shared Dilip and Sunil shared a deep friendship. ""Once...Dutt Sahab met with an...air-crash...Even the injury didn't stop him from hobbling across with a walking stick to...Dilip Sahib's house to wish him Eid Mubarak,"" she recalled.",Entertainment
Why are people Googling it: Bhatt on 'Is Alia happy?' question,"Actress Alia Bhatt, during a segment in an interview with Wired, found out that people also googled 'Is Alia Bhatt happy?'. ""Why are people Googling this?...I understand why...because my resting face...[looks] really sad, but I am very happy,"" she shared. The actress added she's ""possibly the happiest person alive"". Alia will be next seen in 'Heart of Stone'. ",Entertainment
I'm the last Mughal of the film industry: Singer Asha Bhosle,"Veteran playback singer Asha Bhosle on Tuesday, while speaking at a Mumbai event in honour of her legacy, said, ""Only I know the history of the film industry...I'm the last Mughal of this industry."" She added, ""I know everyone's life stories...It'll take me three-four days if I start talking about [them]."" The 89-year-old said she hasn't forgotten anything.",Entertainment
"Producer hired a man, would beat him if Rajesh came late: Prem ","Prem Chopra, in an interview with Bollywood Thikana, recalled an anecdote from the sets of 'Haathi Mere Saathi' and revealed that the producer had hired a man just to beat him up whenever Rajesh Khanna arrived late to set. ""[Producer would] yell at him in front of everybody. Rajesh got the hint, and started arriving on time,"" added Prem. ",Entertainment
"Alia Bhatt teaches Telugu to Gal Gadot, performs 'Naatu Naatu'","During the promotions of her debut Hollywood film 'Heart Of Stone', actress Alia Bhatt taught her co-star Gal Gadot a few phrases in Telugu. In a video, Alia said, ""Andariki namaskaram,"" which translates to ""Hello everyone"". Gadot followed Alia and tried repeating the same. Later, Alia performed hook step of 'RRR' song 'Naatu Naatu' and also taught it to Gadot.",Entertainment
Parents made it seem like divorce wasn’t a big deal: Ira Khan,"Aamir Khan's daughter Ira Khan said the actor's divorce with her mother Reena Dutta was ""one of the trigger points"" of her depression. ""Because they made it seem like divorce wasn't a big deal...there was a perception my mind created of the situation,"" she added. ""I spent 20 years thinking...you've to be sad for people to love you,"" Ira said.",Entertainment
Actress Hina Khan responds after social media user asks her to 'buy' blue tick,"Hina Khan replied after a person asked her to ""buy"" a blue tick for her handle. ""In a world where verification can be bought for a teen's allowance...line between counterfeit and genuine blurs. My...achievements are my real verifications,"" Hina responded. ""True authenticity lies in community support. The realest thing we can hold onto, not captive to...a...mere blue tick,"" she added.",Entertainment
"Thought awards will make me happy, that didn't happen: Hrithik","Hrithik Roshan spoke about experiencing 'What now?' moment at the pinnacle of his career. ""I thought getting up on stage...getting the award was what was going to end it all...make me happy. It didn't...People said [when] you will get your success...you will be happy. It's all lies,"" Hrithik shared. He advised the audience to ""find a higher purpose"" in life.
",Entertainment
People said 'Who will make show for fat girl?': Anjali Anand,"Anjali Anand, who was recently seen in 'Rocky Aur Rani Kii Prem Kahaani' and 'Khatron Ke Khiladi 13', spoke about how people thought her career will be over after her first stint as an actress. ""[People said] I'm not [going] to find work because who's [going] to make a show for a fat girl...I didn't even think...about it,"" she shared. ",Entertainment
"Akshay Kumar's 'OMG 2' gets certification for 12+ in UAE, Oman ","Akshay Kumar's 'OMG 2' has been passed with 12A certificate in UAE and Oman, which means anyone above age of 12 can watch it. Ajit Andhare, COO, Viacom18 Motion Pictures, said, ""Oman [has] cleared...OMG 2...without...cuts. [It's]...been cleared for exhibition...in UAE while Quebec, Canada has cleared it in General category without cuts."" It was granted A certificate in India. ",Entertainment
