Title,Article,Category
Sharad Pawar using guerrilla tactics to fight Ajit faction: Raut,"Shiv Sena (UBT) MP Sanjay Raut said that NCP chief Sharad Pawar is using guerrilla warfare tactics to fight the Ajit Pawar-led NCP faction of legislators who joined the NDA government. This comes after Sharad Pawar said there is no split in his party. Shiv Sena has chosen to fight its war on the battlefield, Raut added.",Politics
ISRO is now BJP's 2024 campaign tool: Mahua Moitra,"After PM Narendra Modi met scientists at ISRO, TMC MP Mahua Moitra said, ""ISRO is now BJP's 2024 [Lok Sabha] campaign tool. Every mission will be used to whip up nationalistic frenzy before elections."" ""Bhakt and troll army working [24x7] to package decades of Indian scientific research as Modi Hai Toh Mumkin Hai magic,"" she added.",Politics
Hatred spread by BJP-RSS reached schools: Maurya on UP slap video,"Reacting to the video showing a teacher making students slap a student in Uttar Pradesh, Samajwadi Party leader Swami Prasad Maurya said, ""The hatred being spread by RSS and BJP today has even reached schools."" ""[The incident] is highly condemnable and I demand that the strictest action be taken against the teacher,"" he added.",Politics
Preparations on to go to Sun and Venus: Anurag Thakur,"After Chandrayaan-3's success, Union Minister Anurag Thakur said that preparations are underway to go to the Sun and Venus. ""The way PM was welcomed after his BRICS Summit and the way he motivated our scientists, I can say it was first Mangalyaan, then Chandrayaan [and] now preparations are underway to go to Sun and Venus also,"" he said.",Politics
Does accused Muzaffarnagar teacher have links with BJP: Gokhale,"After FIR was filed against the teacher who allegedly asked school students to slap their Muslim classmate in Muzaffarnagar, TMC MP Saket Gokhale asked if the ""accused has links with BJP as she has been booked under non-cognizable offences"". He added, ""It's simple section of mischief. Is a teacher encouraging students to assault a fellow Muslim child a mere mischief?""",Politics
Rajasthan CM Ashok Gehlot is very scared of red diary: Amit Shah,"While addressing a gathering in Rajasthan's Gangapur on Saturday, Union Home Minister Amit Shah said that Rajasthan Chief Minister Ashok Gehlot is very scared of a red diary. Shah alleged that the diary contained details of corruption and black deeds related to Gehlot-led Rajasthan government. ""[If] you (Gehlot) have...a little shame then resign on the red diary issue,"" Shah added.",Politics
Is this what PM's New India means: Derek on UP teacher's video,"Reacting to a viral video showing a teacher in UP’s Muzaffarnagar allegedly asking school students to slap a Muslim classmate, TMC MP Derek O’Brien asked if this is what PM Modi's ""New India"" means. He demanded strict action against ""such brutality"". He added, ""The brazen display of inhumanity at a school…is proof of how deep-rooted hatred is in BJP-ruled states.""",Politics
Nation hangs head in shame: Varun Gandhi on UP boy slap video,"After a video showing a teacher making students slap a Muslim boy surfaced, BJP MP Varun Gandhi said the incident has ""made the whole nation hang its head in shame"". He added that a teacher is a ""gardener"" who not only builds a personality but the nation. ""So, the expectations from a teacher are high, beyond dirty politics,"" he said.",Politics
63 people booked coach: Railways official on Madurai train mishap,"As ten people were killed after a fire broke out in a parked tourist train’s coach near Madurai Railway Station, a senior Railways official claimed that a total of 63 people had booked the coach. He further said that the incident took place because of an illegal cylinder. According to reports, the incident happened in the early hours of Saturday.",Politics
"Sonia Gandhi takes boat ride in Srinagar lake, to join Rahul","Congress leader Sonia Gandhi took a boat ride in Nigeen Lake in Srinagar on Saturday. She will join her son, Congress MP Rahul Gandhi, who is staying in a houseboat on the lake. ""It is a completely personal, family visit and no political engagement or meeting with any party leaders will happen,"" a Congress leader said.",Politics
Don't test Punjabis' patience: CM Mann on Guv's Prez rule warning,"Punjab CM Bhagwant Mann hit out at Punjab Governor Banwarilal Purohit after the latter asked him to respond to his letters and warned him of President's rule in the state. ""Don't...test...patience of Punjabis. [Purohit] is deliberately threatening Punjabis by saying that he'll recommend President's rule,"" Mann said. Notably, Purohit had sought a report from Mann on drugs' sale in Punjab.",Politics
Jail is the only place for UP teacher: INC on Muzaffarnagar video,"Congress spokesperson Supriya Shrinate criticised the UP teacher who allegedly asked students to slap their Muslim classmate in a school in Muzaffarnagar. Shrinate urged UP CM Yogi Adityanath to launch an investigation into the matter and said that the ""only place for the teacher is jail"". She added, ""How far has the hatred and poison of bigotry spread?""",Politics
Show in G20 meet: SP on clip of kids being told to slap Muslim boy,"Samajwadi Party chief Akhilesh Yadav has criticised the BJP after video of a teacher in UP's Muzaffarnagar asking students to slap a Muslim boy surfaced online. Akhilesh asked the BJP government to show the video of the incident in the G20 summit and prove that their hate agenda is correct. ""Such a teacher is...blot on the teaching community,"" Akhilesh said.",Politics
What happened to CM's bulldozers: Owaisi on UP teacher's video,"Reacting to a viral video showing a teacher in UP’s Muzaffarnagar allegedly asking school students to slap a Muslim classmate, AIMIM chief Asaduddin Owaisi said that it’s more likely that teacher will get some government award rather than being punished. He questioned CM Yogi Adityanath for not taking his ""bulldozer action"". He added, ""People have no faith in due process.""",Politics
Requested K'taka CM Siddaramaiah not to take trouble of coming early to receive me: PM,"PM Narendra Modi said he requested Karnataka CM Siddaramaiah, Deputy CM DK Shivakumar and Governor Thaawarchand Gehlot to not take the trouble of receiving him in Bengaluru early as he wasn't sure of his arrival time. He said he told them to follow protocol when he would come for a formal visit. Earlier, Congress accused him of breaking the protocol.",Politics
Even Hitler will get ashamed: Sanjay Singh on Punjab Guv's warning,"After Punjab Governor Banwarilal Purohit warned CM Bhagwant Mann’s government of a possible President’s rule in the state, AAP MP Sanjay Singh said that even Adolf Hitler will be ashamed to see this dictatorship. He further said, ""Manipur is burning, the President's rule will not be imposed. No Presidesnt’s rule in Mewat, where violence took place.""",Politics
Don't share video of students: NCPCR on Muzaffarnagar school row,"The chief of the National Commission for Protection of Child Rights, Priyank Kanoongo, has requested everyone not to share the video of a Muslim school student who was seen getting slapped by fellow classmates on the instructions of the class teacher in Muzaffarnagar. Priyank said, ""Do not become a part of the crime by revealing the identity of the children.""",Politics
3 BJP MLAs sworn in as ministers in Madhya Pradesh before state election,"Three BJP MLAs, namely Gaurishankar Bisen, Rajendra Shukla and Rahul Lodhi were inducted into Madhya Pradesh CM Shivraj Singh Chouhan's cabinet on Saturday. The cabinet expansion happened ahead of state polls. ""Will do as much as possible in Bundelkhand for the trust party has shown in us. One and a half months are enough to perform well,"" Lodhi said.",Politics
Need to speak against hatred unitedly: Priyanka on teacher's video,"After a video went viral showing a teacher in UP’s Muzaffarnagar allegedly asking school students to slap a Muslim classmate, Congress leader Priyanka Gandhi said that the country needs to be united to speak against the hatred. She further said, ""What kind of classroom and what kind of society do we want to give to our future generations?""",Politics
You took 'Make in India' to moon: PM Modi lauds ISRO scientists,"PM Narendra Modi lauded the ISRO scientists on the successful Chandrayaan-3 moon mission, saying that the scientists took 'Make in India' to the moon. He announced that India will celebrate August 23 as 'National Space Day'. He said, ""What you all have achieved is one of the most inspiring moments of this era...such occasions are very rare.""",Politics
India showed its capability by hoisting tricolour on moon: PM Modi,"Reacting to the successful Chandrayaan-3 mission, PM Narendra Modi said that India has shown its capability by hoisting the tricolour on the moon. While addressing the Indian community in Athens, PM Modi said, ""It is the month of Sawan, in a way, it’s the month of Shivji, and in this holy month, the country has yet again achieved something new.""",Politics
Hatred: Rahul on clip of UP teacher asking kids to slap Muslim boy,"Congress leader Rahul Gandhi reacted to the video wherein a female teacher was allegedly seen asking Hindu students to slap a Muslim classmate in Uttar Pradesh's Muzaffarnagar. Rahul said, ""Sowing...poison of discrimination in the minds of innocent children [and] turning a holy place like school into a marketplace of hatred."" ""This is the same kerosene [which's] spread by...BJP,"" he added.",Politics
Madhya Pradesh is 'ghotala' & 'bhrashtachar' pradesh: Kamal Nath,"Former Madhya Pradesh CM Kamal Nath criticised CM Shivraj Singh Chouhan, saying that the state has become 'ghotala' (scam) pradesh and 'bhrashtachar' (corrupt) pradesh. He further said, ""Give money and take work, such a system of corruption has been made. If you (people) are not victims of corruption, then you are witnesses to corruption.""",Politics
"In rape with murder cases, UP is first while Raj is 10th: Gehlot","Addressing a press conference on Friday, Rajasthan CM Ashok Gehlot said, ""In cases of rape with murder, Rajasthan is on the tenth position, whereas Uttar Pradesh is first."" Assam and Madhya Pradesh are second and third respectively, he added. He further said that the Opposition (BJP) leaders and Union Ministers are spreading rumours to defame Rajasthan.",Politics
SC rejects Kejriwal's plea against Guj HC order in defamation case,"As Gujarat High Court refused an interim stay on defamation proceedings against Delhi CM Arvind Kejriwal over his remarks on PM Narendra Modi's degree, the AAP chief had moved the Supreme Court. However, the top court on Friday dismissed Kejriwal's plea noting that the matter will be heard by the high court on August 29.",Politics
Why PM Modi running behind Chinese Prez for discussion: Owaisi,"Reacting to the alleged border dispute with China, AIMIM chief Asaduddin Owaisi accused the PM Narendra Modi-led government of keeping the country in the dark. He questioned, ""Why is the PM running behind the Chinese President [Xi Jinping] for talks? What's the reason that...government is pressuring Army to accept their solution? Why does he want to reward Chinese troops?""",Politics
Will take call on OPS after Centre's decision: Haryana CM,Haryana CM Manohar Lal Khattar said the state government will take a call on the demand for the old pension scheme (OPS) after the Centre's decision on it. CM Khattar said this in a written reply in the Monsoon Session of the State Assembly. The Centre has formed a committee to look into the issue under the national pension scheme.,Politics
"Rahul Gandhi visits Kargil War Memorial, pays tribute; pics out","Congress MP Rahul Gandhi visited the Kargil War Memorial in Ladakh and paid tribute to soldiers who lost their lives during the war against Pakistan in 1999. The Congress shared the images and said, ""Kargil is a symbol of courage and valour of our soldiers. We have pride, we have self-respect…Protecting the motherland is the responsibility of every single Indian.""",Politics
Govt must focus on onion issue before Sun mission: Shiv Sena (UBT),"In an editorial in its mouthpiece Saamana, Shiv Sena (UBT) criticised the Centre's decision to impose 40% export duty on onion. ""The people (of India) are being engaged in new missions like Moon mission, Sun mission and Venus mission. Mission Sun is all fine, but it is very much essential that the onion issue in the state stabilises,"" it said.",Politics
NCP chief's statements on Ajit creating confusion: Shiv Sena (UBT),"Reacting to NCP chief Sharad Pawar's 'Ajit is our leader' remark, the Shiv Sena (UBT) raised concerns and said that Pawar’s statements are creating confusion in the minds of party workers. Shiv Sena (UBT) MLC Ambadas Danve said, ""They (NCP) may not consider them traitors, but we consider those who left Shiv Sena (UBT) as traitors only.""",Politics
"Nitish calls Lalu 'bechara', says 'Unnecessarily being troubled'","After the CBI sought the cancellation of bail granted to former Bihar CM Lalu Prasad Yadav in fodder scam case, CM Nitish Kumar called Lalu 'bechara' (helpless) and said that Lalu is being troubled unnecessarily. He further said, ""Those at the Centre have been troubling everyone."" Earlier, Lalu Yadav said that CBI cannot challenge the bail just because it's dissatisfied.",Politics
"He's playing badminton, bail is wrong: CBI to court on Lalu's bail","The CBI challenged the bail granted to ex-Bihar CM Lalu Prasad Yadav in a fodder scam case in Supreme Court, saying the decision to grant him bail is ""wrong"". The RJD chief's lawyer said Lalu had a kidney transplant but CBI wanted to send him to jail again. To this, the CBI's lawyer said Lalu was recently seen playing badminton.",Politics
"Caste survey completed, data being compiled: Bihar CM Nitish Kumar","Bihar CM Nitish Kumar said that the caste-based survey in the state has been completed. ""Now the data is being compiled and it will soon be made public,"" he added. The caste-based survey will enable the government to work for the development of various sections of society, including those who are deprived, he said.",Politics
Respond to my letters or I'll write to President: Punjab Guv Purohit to CM Mann,"Punjab Governor Banwarilal Purohit has asked CM Bhagwant Mann to respond to his letters, failing which he would have to write to the President. ""Not furnishing the information which was sought by the governor would be plainly in dereliction of the constitutional duty,"" the latest letter read. Purohit asked Mann to submit a report on drug abuse in Punjab immediately.",Politics
AAP leader Satyendar Jain's interim bail extended till Sep 1 by SC,The Supreme Court has extended AAP leader Satyendar Jain's interim bail till September 1 after taking note of his medical report. Jain had undergone a spinal surgery in July. The top court on July 24 had extended his interim bail by five weeks. Jain was arrested in a money laundering case probed by the Enforcement Directorate.,Politics
TN minister Senthil Balaji's judicial custody extended till Aug 28,Jailed Tamil Nadu minister Senthil Balaji's judicial custody has been extended till August 28 by a special court. The jail authorities have been asked to produce Balaji physically that day for further proceedings. Balaji was arrested under the Prevention of Money Laundering Act (PMLA) by Enforcement Directorate (ED) in an alleged cash-for-jobs scam.,Politics
"China took thousands of kilometres of our land, PM lying: Rahul","Congress MP Rahul Gandhi reiterated his claim related to Chinese incursions, saying that China has gotten hold of thousands of kilometres of India’s land. Criticising PM Narendra Modi, Rahul said, ""It is sad that the PM in the Opposition meeting said that 'not even an inch of Ladakh has been taken by China'. This is a lie.""",Politics
"Jay Shah is BCCI's Secretary, isn't it 'parivaarvaad': Kanhaiya","Reacting to the BJP’s allegations of nepotism against Congress, leader Kanhaiya Kumar said that Union Home Minister Amit Shah’s son Jay Shah has become BCCI Secretary and asked if this is not 'parivaarvaad'. While addressing public gathering, Kanhaiya asked people if they had seen Jay Shah's face. He added, ""Jyotiraditya Scindia [was called dynast and now he is with BJP].""",Politics
Ex-UP minister Amarmani jailed for his pregnant girlfriend's murder in 2003 to be set free,"Former UP minister Amarmani Tripathi (66) and his wife Madhumani (61), who were sentenced to life imprisonment for the murder of poetess Madhumita Shukla in 2003, will be released from jail over old age and good behaviour, Gorakhpur jail superintendent Dilip Pandey said. Shukla was pregnant when she was murdered and she was allegedly in a relationship with Amarmani. ",Politics
"PM Modi seen wearing floral Greek headdress in Athens, video out","PM Narendra Modi received a grand welcome upon his arrival at the Hotel Grande Bretagne in Greece's capital, Athens, with chants of 'Bharat Mata Ki Jai' and 'Modi, Modi'. In a video, PM Modi can be seen wearing a floral Greek headdress and talking to children. The video also shows Indian diaspora shaking hands with the Prime Minister.",Politics
PM Narendra Modi gifts pair of 'surahi' to South African President,PM Narendra Modi gifted a pair of 'surahi' from Telangana to South African President Cyril Ramaphosa and a Nagaland shawl to his wife during his visit for the BRICS Summit. The shawl is reportedly known for its vibrant colours and intricate designs. PM Modi also gifted a Gond painting from Madhya Pradesh to Brazilian President Luiz Inacio Lula da Silva.,Politics
What's wrong: BJP leader on Rajinikanth touching UP CM Yogi's feet,"Amid controversy over actor Rajinikanth touching Uttar Pradesh CM Yogi Adityanath's feet, Tamil Nadu BJP chief K Annamalai said Rajinikanth was showing respect, and there was nothing wrong in it. Annamalai said Adityanath is the head of the Gorakhpur Mutt, and people in UP call him Maharaj. So, if Rajinikanth touches his feet, there's nothing wrong in it, he added.",Politics
Muslims are under attack in India: Rahul Gandhi,"During his interaction with youths in Kargil, Congress leader Rahul Gandhi said that Muslims aren't safe in India, adding that minorities feel ""uncomfortable"" in India. He said, ""Muslims are under attack in India. But you must also realise that there're...[others] also [who're] under attack."" ""I believe regardless of which religion you're from...you must feel comfortable in this country,"" he said.",Politics
"Ajit Pawar is our leader, there's no split in NCP: Sharad Pawar","Sharad Pawar said that there's no split in NCP, the party he founded. ""Ajit Pawar is our leader,"" he said, adding that a split happens when a big group separates at a national level. ""There is no such situation in NCP today,"" he said. Earlier, his nephew Ajit joined the Maharashtra government led by the BJP and Shiv Sena.",Politics
MK Stalin serves food to students while launching breakfast scheme,Tamil Nadu CM MK Stalin launched the expansion of the state government’s breakfast scheme for school children in Nagapattinam district. A video has surfaced on social media showing Stalin serving food to the students and also having breakfast with them. He can also be seen talking to children while they are eating. This scheme will benefit around 17 lakh students.,Politics
"Omar mocks National Integration award for The Kashmir Files, Vivek Agnihotri reacts","Former J&K CM Omar Abdullah mocked The Kashmir Files after it won the Nargis Dutt award for best film on national integration as the 69th National Film Awards were announced on Thursday. The film's director Vivek Agnihotri replied, ""This is the biggest award coming from you Omar Abdullah. If you had commented otherwise, I'd have been very disappointed. Thanks again."" ",Politics
Ex-Jharkhand CM Marandi booked for derogatory remarks against CM Soren,"Former Jharkhand CM and BJP leader Babulal Marandi has been booked for allegedly making hateful and derogatory remarks against CM Hemant Soren and his father and JMM chief Shibu Soren. Marandi in a speech purportedly said the father-son duo promoted ""nothing but corruption"". A JMM worker filed an FIR against Marandi following which he was booked under IPC sections.",Politics
"UCC unacceptable, won't accept even small change in Sharia: AIMPLB",A delegation of the All India Muslim Personal Law Board (AIMPLB) met the chairperson of the Law Commission of India and said that Uniform Civil Code (UCC) is unacceptable to Muslims. The delegation said that they won't accept a minute change in the basic format of Sharia. AIMPLB chief Maulana Khalid Saifullah Rahmani was also present during the meeting.,Politics
Film will definitely be made on Chandrayaan-3 mission: Hema Malini,"As India becomes the first country to successfully land a spacecraft on the moon's south pole, BJP MP Hema Malini said that a film will definitely be made on Chandrayaan-3 mission. She sang the song ""Chalo dildaar chalo chand ke paar chalo"" from the 'Pakeezah' movie. She added, “I was very happy to see that our India is making progress.""",Politics
"Tej Pratap Yadav pushes and grabs man by throat, video surfaces",The eldest son of former Bihar CM Lalu Prasad Yadav and Bihar Environment Minister Tej Pratap Yadav was caught pushing a person by grabbing his throat on camera. A video in which Tej Pratap was seen pushing the person and abusing him has surfaced online. The incident took place in Gopalganj where the RJD leader had gone for a visit.,Politics
I can guarantee you that we will defeat BJP in 2024: Rahul Gandhi,"While addressing a gathering in Ladakh, Congress MP Rahul Gandhi said that he can guarantee that the Congress will defeat the BJP in 2024 Lok Sabha elections. He further said, ""Elections are about to be held in Madhya Pradesh, Rajasthan, Chhattisgarh and Telangana. You will see who is going to lose...You guys shouldn’t think that Congress cannot fight the BJP.""",Politics
How did Rahul think of Manipur while visiting Ladakh: Manipur CM,"Manipur CM N Biren Singh has reacted to Congress leader Rahul Gandhi's visit to Ladakh. He said, ""How did Rahul Gandhi think of Manipur while in Ladakh? Speak of Ladakh, if you are going to Ladakh."" CM Singh added, ""What is happening in Manipur today was all created by Congress. Politics should not be done over human lives.""",Politics
PM quick to come on screen & take credit after Moon landing: INC,"Congress' KC Venugopal on Thursday asked PM Narendra Modi why he cut the budget for such crucial missions by 32%. ""You were quick to come on screen and take credit after the landing, but why has your government failed so terribly in supporting the scientists and the ISRO?"" he further asked. Chandrayaan-3 soft landed on the Moon on Wednesday.",Politics
Gandhis made Aiyar say PV Rao was PM from BJP not Congress: Patra,"BJP's Sambit Patra has said that Gandhis made former Union Minister Mani Shankar Aiyar say that former PM PV Narasimha Rao belonged to BJP and not Congress. Responding to Aiyar's remark on Rao, Patra said that the Gandhi family's spokesperson cannot tolerate someone other than a Gandhi family member becoming PM, even if the person is from within the party. ",Politics
Maharashtra govt has policy paralysis: Sule on onion export duty,"NCP (Sharad Pawar's faction) leader Supriya Sule on Thursday criticised the Maharashtra government over export duty on onions, saying that the state government was exhibiting ""complete policy paralysis"". Sule said she has been raising the issue of onions through social media for the last four months, adding that she requested the Centre to come out with a clear policy. ",Politics
"Fadnavis chants Hanuman Chalisa in Japan during Chandrayaan-3 landing, video viral","Maharashtra Deputy Chief Minister and BJP leader Devendra Fadnavis, who is in Japan for a five-day visit, chanted Hanuman Chalisa during the landing of Chandrayaan-3. ""Unmissable enthusiasm and spirit,"" he wrote while sharing the video. India has become the first nation to successfully land a spacecraft near the Moon's south pole and the fourth nation to land on the Moon. ",Politics
1 sexual predator MP brought sport to its knees: Moitra on WFI ban,"TMC MP Mahua Moitra on Thursday reacted to WFI being suspended by the United World Wrestling (UWW) for not holding its elections on time. She said, ""Shame on the BJP government, shame on @YASMinistry for allowing one sexual predator MP to bring the sport to its knees."" The elections were supposed to take place in June. ",Politics
"Sonia writes to ISRO chief, says thrilled by Chandrayaan-3 success","Congress leader Sonia Gandhi wrote a letter to ISRO chief S Somanath following Chandrayaan-3's landing on the Moon. She said she was ""thrilled"" by ISRO's ""magnificent achievement"". ""ISRO's outstanding capabilities have been built up over [the] decades,"" she added. She said the organisation is being anchored on self-resilience since the early sixties and that has contributed to its great successes.",Politics
"Centre must pay ₹4,000 per quintal for onion: Sharad Pawar","NCP chief Sharad Pawar has demanded an increase in the rate of procurement of onions by the Centre through NAFED to ₹4,000 per quintal. ""Centre's decision to give ₹2,410 per quintal is not acceptable,"" he added. Criticising Centre's decision to impose a 40% duty on onion export, Pawar said that it is ""unacceptable"" and ""it will hurt farmers"".",Politics
