Title,Article,Category
"Rahul blew flying kiss while leaving Parliament, says Smriti; calls him misogynistic","While exiting the Lok Sabha after delivering his speech on the no-confidence motion, Congress' Rahul Gandhi blew a flying kiss, alleged Union Minister Smriti Irani. ""It is only a misogynistic man who can give a flying kiss to a Parliament which seats female members,"" she said. Further, she added such conduct has never been seen in Parliament.",Politics
Manipur govt booked Assam Rifles which is under Shah: Congress MP,"Congress MP Gaurav Gogoi on Wednesday said that Manipur's home department filed an FIR against Assam Rifles, which is under Union Home Minister Amit Shah and questioned how the ""double-engine government is working"". Moreover, he said that he also wants to ask Shah what the committee of former High Court judges, formed to investigate Manipur violence, has done so far.",Politics
"Lord Ram didn't kill Ravan, he died because of arrogance: Rahul","Congress MP Rahul Gandhi said in Lok Sabha that neither was Ravan killed by Lord Ram, nor was Lanka torched by Lord Hanuman. They perished because of Ravan's arrogance, he added. He claimed the Centre is setting India on fire. Rahul added, ""Ravan listened to two people- Meghnad and Kumbhakarn...[PM] Narendra Modi listens to two people- Amit Shah and Adani.""",Politics
"Congress clapped, thumped tables over Bharat maa's murder: Irani","Union Minister Smriti Irani has reacted to Congress leader Rahul Gandhi's ""you killed Bharat Mata in Manipur"" remark, saying that it's the first time that ""Bharat maa ki hatya (murder of Mother India)"" has been brought up in Parliament. Adding that Congress leaders clapped and thumped tables during Rahul's statement, she further said this shows who is the ""traitor"".",Politics
"Farmer gave me cotton, said 'Nothing else left on my farm': Rahul","While speaking in the Lok Sabha, Congress MP Rahul Gandhi recalled meeting a farmer during Bharat Jodo Yatra. He said the farmer gave him a bundle of cotton and said he had nothing else left on his farm. On being asked if he had received bima money, Rahul said the farmer replied, ""No...India's big industrialists snatched it away from me.""",Politics
Manipuri woman told me her only son was shot dead: Rahul Gandhi,"While speaking on the no-confidence motion against the government in Lok Sabha, Wayanad MP Rahul Gandhi said he met a woman at a relief camp who told him her only son was shot dead. ""She said she stayed with the dead body of the child for the whole night,"" Rahul said. He had visited Manipur in June. ",Politics
"You're a traitor, not a patriot: Rahul during no-confidence debate","Congress MP Rahul Gandhi while speaking on the no-confidence motion against the government, has said, ""You are a traitor, you are not a patriot."" Claiming that 'Bharat Mata' was killed in Manipur, he added, ""Bharat hamari janta ki awaaz hai...Uss awaaz ki hatya aapne Manipur mein ki. (India is the voice of our people...You killed that voice in Manipur).""",Politics
Won't speak on Adani: Rahul to BJP in 1st speech after LS return,"As he addressed Lok Sabha for the first time since his status as an MP was restored, Congress leader Rahul Gandhi thanked the Speaker for his reinstatement. He also apologised to the Speaker for ""pain"" he might have caused as he ""focussed on Adani"" when he last spoke. ""Today...BJP need not be scared because my speech...isn't on Adani,"" he added.",Politics
"RS MPs observe silence, pay homage to Quit India Movement martyrs","MPs observed a moment of silence in Rajya Sabha on Wednesday to pay homage to martyrs of the Quit India Movement. Chairman Jagdeep Dhankhar noted that today marks the 81st anniversary of the launch of the Mahatma Gandhi-led movement. ""The...movement is an epitome of what people are capable of achieving if they work in togetherness for a cause,"" he added.",Politics
"India murdered in Manipur, PM doesn't consider it part of India: Rahul Gandhi","While speaking on the no-confidence motion against the Centre in Lok Sabha, Wayanad MP Rahul Gandhi said PM Narendra Modi hasn't visited Manipur, which has been witnessing violence since May, yet because he doesn't consider the state a part of India. ""You have murdered India in Manipur,"" he said. He also accused the Centre of dividing Manipur into two. ",Politics
Sent loud message: Delhi CM on ex-PM Manmohan attending RS in wheelchair,"Delhi CM Arvind Kejriwal has thanked ex-PM Manmohan Singh for rejecting Delhi Services Bill and championing the rights of the national capital's people despite his deteriorating health. ""Your...presence...sent a loud and clear message,"" he said. Singh had attended the discussion on Bill in a wheelchair. He also thanked Congress leaders Mallikarjun Kharge and Rahul Gandhi for their party's support.",Politics
BJP MPs carry 'Dynastic Politics Quit India' posters to Parliament,"To commemorate Quit India Movement's anniversary, BJP MPs launched 'Quit India' campaign near Mahatma Gandhi's statue on the premises of the Parliament. A video showed the MPs holding placards reading, 'Corruption Quit India', 'Dynastic Politics Quit India' and 'Nepotism Quit India'. BJP MP Nishikant Dubey said Congress gave dynastic politics to India, which is eating up the country like termites.",Politics
BRS leader Pogula Laxmirajam stabbed to death in Telangana,"A leader of BRS and husband of a municipal councillor was stabbed to death in broad daylight in Telangana's Korutla town, the police said. The deceased Pogula Laxmirajam was stabbed by two bike-borne men while he was having tea at a shop at around 9 am on Tuesday. The reason for the murder is not yet known, the police added.",Politics
Insult to democracy: Udit Raj on Dubey's remark against Sonia,"Reacting to BJP MP Nishikant Dubey's remark against Sonia Gandhi that she wants to settle her son and give gifts to son-in-law, Congress leader Udit Raj said that Dubey's remark was an insult to democracy and the people. ""It is the people of the country who set you...A particular person can't set their son, relative in politics,"" he added.",Politics
Ex-AAP councillor Tahir instigated mob: Court on Delhi riots case,"A sessions court has framed charges against former AAP councillor Tahir Hussain and nine others in a case related to the 2020 northeast Delhi riots. ""Evidence shows that...mob was instigated by Tahir...to indulge in vandalism, loot and arson,"" the court said. The court took note of statements that said Tahir had ""pointed"" towards some shops, which were later vandalised.",Politics
I feel sad on being called foreigner: Son of Manipur BJP MLA Valte,"Injured BJP MLA Vungzagin Valte's son, Joseph, stated that he feels ""really sad"" when someone calls his Kuki community ""foreigners"". Claiming that the Kuki-Zomi community never demanded independence from India, Joseph said, ""We respect our national flag and anthem."" Valte was attacked in May during ethnic clashes in Manipur, following which the left side of his body was left paralysed.",Politics
Rahul's bungalow not PM's parental property: Congress' Shrinate,"Reacting to BJP's Ravi Kishan's statement that PM Narendra Modi has ""shown a big heart"" by giving Rahul Gandhi his government bungalow in Delhi back, Congress' Supriya Shrinate said that Rahul's bungalow was not PM Modi's parental property. ""The bungalow was acquired by Rahul Gandhi through public's votes and not by PM Modi's mercy,"" Shrinate added.",Politics
"TN Police, officials remove 'Bharat Mata' statue from BJP office","Police and revenue department officials have removed a statue of 'Bharat Mata' from the premises of a BJP office in Tamil Nadu's Virudhunagar district. The action was taken as the statue was allegedly placed without permission. ""Under...corrupt DMK government...there's no right even to install a statue of Bharat Mata in a place owned by...party,"" state BJP chief K Annamalai said.",Politics
PM Modi is guiding everything: Assam CM Himanta on Manipur issue,"After the Congress questioned PM Narendra Modi's silence over the Manipur issue, Assam CM Himanta Biswa Sarma criticised the Congress. ""PM Modi knows everything, he's guiding everything. We know that he's in command,"" Sarma said. ""You must see the wisdom of PM when he will answer on the no-confidence motion,"" Sarma said, adding PM Modi has visited northeast 60 times.",Politics
Those calling Ram imaginary are organising religious katha: MP CM,"After former Madhya Pradesh CM Kamal Nath and his son Nakul Kamal Nath attended self-styled godman Dhirendra Shastri's 'katha' on Saturday, CM Shivraj Singh Chouhan criticised Kamal Nath. ""Those (Congressmen) who were afraid to take the name of [Lord] Ram and used to call Ram...imaginary...are organising religious katha,"" he said. ""This is the electoral devotion of...Congress party,"" he added.",Politics
INC names Oommen Chandy's son as candidate for Puthuppally bypoll,"Congress has named Chandy Oommen, son of former Kerala CM Oommen Chandy, as its candidate for the upcoming bypoll to Puthuppally Assembly constituency. The AICC in a statement said that Congress chief Mallikarjun Kharge has approved his candidature. The bypoll was necessitated after the former CM passed away last month.",Politics
BJP didn't give chance to 2 Manipur MPs to speak in LS: Gogoi,"Congress MP Gaurav Gogoi on Tuesday said that despite having two MPs from Manipur, BJP didn't give them a chance to speak in the Lok Sabha. He said just like his own party, BJP should've let MPs from Manipur talk about the actual situation of the state. ""This shows that they are ignoring the Manipur issue,"" he added. ",Politics
Disputes in Northeast due to wrong policies of Congress: Assam CM,"Assam CM Himanta Biswa Sarma on Tuesday said that the various disputes that exist in the northeastern states are because of the wrong policies of Congress during the formative years after Independence. He accused Congress of not defining boundaries of the states properly. The hallmark of Congress' policy in the Northeast was divide and rule, he added.",Politics
Odisha CM doesn't believe in needless quarrels with Centre: BJD,"BJD MP Pinaki Misra on Tuesday opposed Opposition's no-confidence motion against the Central government, saying Odisha CM Naveen Patnaik does not believe in ""needlessly picking quarrels"" with the Centre. He added that ""anti-Congressism"" was the foundation of the BJD and it was not possible for his party ""to support any motion brought on by the Congress"".",Politics
Shiv Sena MP Shrikant Shinde recites Hanuman Chalisa in Parliament,"Shrikant Shinde, Shiv Sena (Shinde faction) MP and Maharashtra CM Eknath Shinde's son, recited Hanuman Chalisa during debate on no-confidence motion in Parliament on Tuesday. He was referring to the controversy that erupted in Maharashtra last year over reciting Hanuman Chalisa outside Shiv Sena (UBT) leader Uddhav Thackeray's home. The chair asked him to stop and continue with his speech.",Politics
Crossed the limits of humanity: Sachin Pilot on Bhilwara incident,"Speaking on the Bhilwara rape and murder case, Congress leader Sachin Pilot on Tuesday said, ""Those who had committed this heinous crime have crossed the limits of humanity"". ""I've met the relatives of the victim and got to know that all the accused have been arrested and the police are also going to detain the two minors,"" Pilot said.",Politics
PM said Oppn moved no-trust motion to check its own unity: Meghwal,"PM Narendra Modi said that the Opposition brought no-confidence motion against the government to test unity among its own alliance members, according to Union Minister Arjun Ram Meghwal. In his address to BJP MPs at a closed-door meeting of its parliamentary party, PM Modi is also said to have congratulated the party's Rajya Sabha members for passing Delhi services bill.",Politics
"'Tumhari aukat nikalunga,' Union Minister Rane tells Shiv Sena UBT MP in Parliament","After Shiv Sena (UBT) MP Arvind Sawant criticised BJP and NDA government in Lok Sabha, Union Minister Narayan Rane said, ""BJP aur mananiye PM...pe ungli bhi [uthaya] naa toh tumhari aukat main nikalunga (If you dare point fingers at BJP and PM, I'll show you your status)."" Rane, on being interrupted during his speech, told Sawant, ""Neeche baith (sit down).""",Politics
Opposition needs to learn to respect women: Navneet Rana in LS,"Speaking during the no-confidence motion in Lok Sabha, independent candidate Navneet Ravi Rana said the Opposition needs to learn to respect women. ""The Opposition is silent on what happened in Rajasthan,"" Rana said. ""I want to ask the Opposition, if women of Manipur were important, why did your delegation not visit Manipur after May 4,"" she said.",Politics
PM has shown big heart: Kishan on Rahul getting govt bungalow back,"BJP's Ravi Kishan, reacting to Congress leader Rahul Gandhi getting his government bungalow in Delhi back, said PM Narendra Modi has ""shown a big heart"". Although the (Supreme) Court has put his conviction on 'stay', he has been re-allotted the house,"" he said, adding that Rahul should acknowledge the gesture and appreciate PM Modi's efforts. ",Politics
PM pushes Congress through shredder each time he speaks: BJD MP,"Biju Janata Dal (BJD) opposed the Opposition's no-confidence motion in the Parliament, saying it is grateful to the Centre for whatever it has done for Odisha. BJD MP Pinaki Misra said, ""They know that every time the PM has got up to speak on the floor of this House, he has pushed the Congress party through the shredder.""",Politics
"Being an MP from Northeast, you should thank PM: Rijiju to Gogoi","Union Minister Kiren Rijiju on Tuesday criticised Congress leader Gaurav Gogoi, saying being an MP from the Northeast, he should've thanked PM Narendra Modi. ""Before 2014, many people from the Northeast faced racial discrimination and atrocities in Delhi and other major cities of the country,"" he said, adding PM earned the trust of eight Northeast states by working for them. ",Politics
"India wasn't a Hindu nation, will never be: Owaisi on INC's remark","After Congress leader Kamal Nath said there's no debate that India is a ""Hindu Rashtra"", AIMIM chief Asaduddin Owaisi tweeted, ""India was never a Hindu nation, is not and will never be"". ""The 'veteran' Congress leader...is clearly saying what Mohan Bhagwat says,"" he added. Nath earlier said that data shows that 82% of people in the country are Hindus. ",Politics
By-elections to 7 legislative Assemblies to be held on Sept 5,"By-elections to fill vacancies in seven Constituent Assemblies of six states (Jharkhand, Uttar Pradesh, Tripura, Kerala, Uttarakhand and West Bengal) will be held on September 5. The counting of votes will take place on September 8. The Election Commission (EC) has said that Voter Verifiable paper audit trail (VVPAT) and Electronic Voting Machines (EVMs) will be used for the elections. ",Politics
Rahul Gandhi to begin phase 2 of Bharat Jodo Yatra from Gujarat,"Congress leader Rahul Gandhi will begin second phase of Bharat Jodo Yatra from Gujarat that will culminate in Meghalaya, Maharashtra Congress chief Nana Patole said on Tuesday. ""Simultaneously, we have planned to conduct a padayatra in Maharashtra,"" Patole said. On Monday, Gujarat Congress said that it had extended an invitation to Rahul Gandhi to begin his journey from the state.",Politics
Won't join hands with BJP: Sharad Pawar to NCP's Pune unit,"NCP chief Sharad Pawar told members of the party's Pune unit that he would not join hands with BJP. He said this when a delegation of over 220 local NCP leaders led by Pune unit chief Prashant Jagtap visited Pawar in Delhi. This comes after several NCP leaders, including Ajit Pawar, joined hands with BJP.",Politics
"INDIA parties went to Manipur, but not PM Modi: DMK MP in LS","While speaking on the no-trust motion brought by the Opposition against the central government, DMK MP TR Baalu on Tuesday said that PM Narendra Modi is not coming to the Parliament and he did not visit Manipur. ""Whereas, the responsible INDIA parties visited Manipur,"" he said. ""143 people have been killed. 65,000 people have fled the state,"" he added.",Politics
Sarva Adivasi Samaj Chhattisgarh to field 50 people in state polls,"Sarva Adivasi Samaj Chhattisgarh President Arvind Netam said the tribal body will field 50 contestants in the state Assembly elections, which is scheduled to be held at the end of 2023. ""Tribal people in Chhattisgarh are fighting for 'jal, jungle, zameen' (water, forest and land),"" the ex-minister added. He claimed the government and the corporate houses are exploiting the tribals.",Politics
Yet to conclude on Derek O'Brien's suspension: RS Chairman,"Rajya Sabha Chairman Jagdeep Dhankhar said he's yet to conclude on TMC MP Derek O'Brien's suspension from Parliament's Monsoon Session. ""If I had really fructified the process...O'Brien would have been out of the House,"" he said. O'Brien was allowed to attend the House proceedings after Dhankhar said he had taken a ""far-sighted"" decision to not allow voting on the suspension.",Politics
He was attending wife's operation: RLD on Jayant's absence from RS,"Rashtriya Lok Dal (RLD) spokesperson Anil Dubey clarified that party chief Jayant Chaudhary was absent in the Rajya Sabha during voting on Delhi services bill as he had to attend his wife's operation. ""He wanted to vote but could not reach,"" Dubey added. Further, he stressed that RLD is with the INDIA bloc. Rajya Sabha passed the bill on Monday.",Politics
Derek O'Brien not suspended from Parliament as motion to suspend him not put to vote,"Trinamool Congress MP Derek O'Brien was allowed to attend the House proceedings hours after media reports said he was suspended for the entire Monsoon Session. The motion to suspend him was not put to vote and he could continue to attend the proceedings. Chairman Jagdeep Dhankhar said he has taken a ""far-sighted"" decision to not allow voting on the motion.",Politics
It was a state-sponsored ethnic violence: Dimple on Manipur,"Speaking on the Manipur situation during the no-confidence motion discussion in Lok Sabha, SP MP Dimple Yadav said, ""It was a state-sponsored ethnic violence."" ""If the visuals hadn't surfaced on social media, nobody would have known what happened in Manipur,"" she added. ""Visuals showed that women were stripped and raped. Who is responsible for it?"" she asked.",Politics
He woke up late: BJP MP as Rahul doesn't open no-confidence debate,"BJP MP Nishikant Dubey noted in the Lok Sabha that Congress leader Rahul Gandhi did not open the no-confidence motion against the Modi government. ""Looks like Rahulji was not ready. He might have woken up late,"" he added. Congress MP Gaurav Gogoi opened the debate in the House on Tuesday. Earlier, reports had claimed that Rahul would open the debate.",Politics
Entire India is my home: Rahul after getting official home back,"Interacting with media after getting his government residence in Delhi back, Rahul Gandhi said, ""Mera ghar poora Hindustan hai (Entire India is my home)."" Rahul said this while going to the AICC Headquarters for a meeting with the leaders of Assam Congress. Rahul had vacated the residence in Tughlaq Lane in April, 2023, after he lost his MP status.",Politics
Every leader in 'INDIA' bloc is PM-in-waiting: Shiv Sena MP in LS,"Shiv Sena MP Shrikant Shinde, during a discussion on the no-confidence motion in the Lok Sabha, said that every leader in the 'INDIA' bloc is a ""PM-in-waiting"", adding that every leader wants to become the PM. He added that the bloc is without a ""captain"" but still wants to play the match (elections) and ""win the world cup"". ",Politics
Rahul Gandhi gets govt bungalow in Delhi back after being reinstated as MP,"Congress MP Rahul Gandhi got his government residence in Delhi back, a day after he was reinstated as a Lok Sabha member, multiple reports said. Gandhi vacated the residence in Tughlaq Lane in April, 2023, after he lost his MP status due to his conviction in the 'Modi surname' defamation case. The Supreme Court stayed the conviction on August 4.",Politics
'INDIA' alliance moves motion against Piyush Goyal in RS over his 'traitors' remark,"Leaders of the Opposition 'INDIA' alliance moved a privilege motion in the Rajya Sabha against Union Minister Piyush Goyal after he addressed them as ""traitors"". Opposition leaders also staged a walk out from the Upper House to protest the remark. ""Nothing less than an apology from [Goyal] on the floor of the House...will do,"" said Congress MP Jairam Ramesh.",Politics
"10,000 riot, murder, rape cases in Manipur, CM must resign: Sule","Speaking during the no-confidence motion in Parliament, NCP MP Supriya Sule called for the immediate resignation of Manipur CM N Biren Singh. ""10,000 cases of rioting, murder and rape [have been filed]. Have we become so insensitive? This is the problem with this government,"" said Sule. Notably, over 150 people have died since the violence started.",Politics
This has never happened: Adhir on restoration of BJP MP's remarks,"After BJP MP Nishikant Dubey's allegations of Congress having links to China were expunged and then restored, party leader Adhir Ranjan Chowdhury said, ""This has never happened in Parliamentary history."" He added that Dubey's ""petty statements"" were removed after Opposition parties complained. He further said that ""surprisingly"" the remarks were uploaded in the record ""once again overnight"". ",Politics
"In rare case, BJP's Nishikant Dubey's remarks on Congress expunged & restored","While speaking in the Lok Sabha on Monday, BJP MP Nishikant Dubey alleged that Congress and China have ties and demanded that the government should investigate the party. ""They want to divide India through the Chinese government and journalists,"" he added. His remarks were expunged from Parliament records but, in a rare move, they were restored by evening. ",Politics
This govt is govt of the heartless: TMC MP Saugata Roy in LS,"While speaking on the no-trust motion brought by the Opposition against the government, TMC MP Saugata Roy on Tuesday called the government ""a government of the heartless"".  ""They're sending delegation to West Bengal on any plea. But not one delegation has gone to Manipur where our brothers and sisters are dying,"" Roy said, adding the government has no compassion. ",Politics
"Video shows Sonia laughing at BJP MP's comments on Rahul, Robert Vadra","A video has surfaced that shows Congress leader Sonia Gandhi laughing at BJP MP Nishikant Dubey's remarks against her son, MP Rahul Gandhi, and son-in-law Robert Vadra during a discussion in Parliament on Tuesday. Dubey said the no-confidence motion against the government is Sonia Gandhi's attempt to ""set up her son and take care of her son-in-law"". ",Politics
Former PM Deve Gowda skips Rajya Sabha proceedings due to illness,"Former Prime Minister and Janata Dal (Secular) President HD Deve Gowda, who is also a member of the Rajya Sabha, said he could not participate in the Rajya Sabha proceedings on Monday due to illness. An important meeting of the JD(S) was also organised in Bengaluru, which the former PM attended for only ten minutes due to hip pain.",Politics
Bring teleprompter if you want but come to RS: Gokhale to PM Modi,"TMC MP Saket Gokhale criticised PM Narendra Modi for having ""little concern for the people of Manipur"". He asked the Prime Minister to address the Rajya Sabha on the issue and said the PM could bring a teleprompter to Parliament if he wanted. He added, ""A PM who parrots 'Beti Bachao' hasn't come to Rajya Sabha for a single day.""",Politics
"Youth Congress protests in Delhi over Manipur violence, inflation","The members of the Indian Youth Congress held a protest against the Centre at Delhi's Jantar Matar over issues like Manipur violence, inflation and unemployment. A video has surfaced on social media showing Delhi Police dragging the protesters and putting them in a bus. According to reports, leaders like Pawan Khera, Alka Lamba and Supriya Shrinate were also present there.",Politics
"PM from a poor family, Rajnath Singh taught in a college: Dubey ","BJP's Nishikant Dubey, during a debate on the no-confidence motion in the Lok Sabha, said PM Narendra Modi is from a ""poor family"". He added Rajnath Singh used to teach in a college and became Defence Minister by ""god's grace"". ""This no-confidence motion is against the son of a poor...against a man who gave toilets to the people,"" Dubey said.",Politics
I'm not a political figure: Dhirendra Shastri after meeting Nath,"After meeting Congress leader and ex-Madhya Pradesh CM Kamal Nath, self-styled godman Dhirendra Shastri claimed he's not a political figure. He also urged people to keep him away from politics. Shastri, who's also known as Bageshwar Baba, met Nath when the latter attended his 'katha' on Saturday. Earlier, Nath's son Nakul claimed the meeting had nothing to do with politics.",Politics
NCP MLA removed from party's working committee over 'indiscipline',"NCP chief Sharad Pawar removed the party's Kerala MLA Thomas K Thomas citing ""serious indiscipline"" by ""making irresponsible allegations against party members"". This comes after Thomas filed a complaint with Kerala Police chief alleging that some members of his party were planning to kill him. The allegation was rejected by the party's Kerala chief PC Chacko.",Politics
"There's no debate we're Hindu Rashtra, 82% Hindus in nation: Nath","Madhya Pradesh's former CM and Congress leader Kamal Nath has claimed that data shows that 82% of people in the country are Hindus, therefore, ""there is no debate here that we are a Hindu Rashtra"". Nath made the remark after he was questioned if he supported self-styled godman Dhirendra Shastri's alleged demand for a 'Hindu Rashtra'.",Politics
