Title,Article,Category
If PM Modi can meet Nawaz why can't Ajit meet Sharad Pawar: Raut,"Reacting to reports of Ajit Pawar and Sharad Pawar holding a 'secret meet', Shiv Sena (UBT) leader Sanjay Raut said that if Prime Minister Narendra Modi can meet former Pakistan PM Nawaz Sharif, why can't Ajit Pawar meet Sharad Pawar. ""I believe Sharad Pawar will talk about this meet in a day or two,"" Raut added.",Politics
BJP following British policy of divide and rule: Akhilesh Yadav,"Former UP CM Akhilesh Yadav said that the BJP is following the British policy of divide and rule and accused it of spreading anarchy in Uttar Pradesh. He further said, ""The Constitution is in danger because of the BJP. Freedom of expression is being crushed...The bulldozer should not become a symbol of injustice. Is there no bulldozer in double-engine Manipur?""",Politics
"Vegetable vendor asks 'Can I speak to Rahul?', INC shares video","Congress shared a video of a vegetable vendor, Rameshwar, who can be heard asking if he can talk to Congress leader Rahul Gandhi. He is the same vegetable vendor who broke down while talking about the tomato price hike last month. The Congress leader had gone to Delhi's Azadpur Mandi after Rameshwar's video went viral.",Politics
Names of Centre's bills are in Hindi & hard to pronounce: DMK,"The DMK has criticised the Centre for introducing Hindi names for bills to revamp criminal laws. DMK MP P Wilson accused the Centre of forcing Hindi across the country by introducing such bills in Parliament. Wilson said, ""English is the common language...The names [of bills] are hard to pronounce [as the names of bills are in Hindi].""",Politics
PM Modi’s speech was lowbrow 'gud gobad' stand-up comedy: Mahua,"Reacting to PM Narendra Modi’s reply on the no-confidence motion in Parliament, TMC MP Mahua Moitra criticised the Prime Minister and shared a post calling the BJP ""Best Joker Party"". Mahua said, ""Nation expected a Prime Minister’s speech in Lok Sabha on Manipur. What it got was lowbrow 'gud gobad' stand-up comedian act post a dandiya programme in Ahmedabad.""",Politics
PM should have checked facts before speaking on Bihar AIIMS: Jha,"RJD MP Manoj Jha said that the team which writes speeches for PM Narendra Modi is not checking facts before writing things. ""What PM said on AIIMS Darbhanga is not true...He should keep a fact checker with himself,"" he added. Bihar Deputy CM Tejashwi Yadav had to conduct press conference to tell the truth to people, Jha further said.",Politics
Kamal Nath called our ex-minister 'item': Shivraj on women safety,"Reacting to former Madhya Pradesh CM Kamal Nath’s remark on women's safety, CM Shivraj Singh Chouhan said that speaking about women's safety doesn’t suit Nath because he had called a female BJP leader and ex-minister an ""item"". He further said, ""[Kamal Nath] laughed after making the remark."" Earlier in July, Kamal Nath said that women aren't safe in Madhya Pradesh.",Politics
"Manipur burning, Irani bringing up my pic with Adani: Robert Vadra","Congress leader Priyanka Gandhi's husband Robert Vadra has criticised Union Minister Smriti Irani for bringing up his picture with billionaire Gautam Adani in Lok Sabha. ""Manipur has been burning and [Irani] has to bring up...negative thing about me. I'm not even in Parliament,"" he added. He also asked Irani to provide proof of his alleged close relations with Adani.",Politics
"Priyanka is qualified, should be in Lok Sabha for sure: Robert","Congress leader Priyanka Gandhi's husband Robert Vadra has asserted that he feels that Priyanka should be in Parliament, especially Lok Sabha. ""[Priyanka] has all the qualifications for it. She would be very good in Parliament and she deserves to be there,"" he said. He added that he hopes that the Congress party ""accepts and plans better"" for Priyanka.",Politics
AAP is a 'jhagdalu' and 'nikammi' govt: Sushma Swaraj's daughter,"BJP leader Bansuri Swaraj criticised the AAP government in Delhi over the Delhi Services Bill and said that since 2015 the AAP government made excuses for their inefficiency. ""It is a 'jhagdalu' (quarrelsome) and 'nikammi' (useless) government,"" she added. ""Now that the Bill is passed, the administration in Delhi will work in accordance with the law,"" she added.",Politics
"PM spoke on Bharat Mata's murder for 2 minutes, how dare he: Rahul","Criticising PM Narendra Modi over the Manipur unrest, Congress leader Rahul Gandhi said that the Prime Minister spent only two minutes talking about the ""murder of Bharat Mata"". He further added, 
""How dare you do this? How can you destroy the idea of India? What have you been doing for the last four months? Why were you not there?""",Politics
"Wanted to become doctor, used to study till 3 am: Rajasthan CM","Rajasthan CM Ashok Gehlot expressed disappointment over the rising cases of suicide in Rajasthan's Kota and claimed that he himself wanted to become a doctor when he was a child. He further said, ""[I] used to study till 2 am-3 am in the night, but did not succeed. However, I did not lose courage. I changed my path.""",Politics
We don't do politics over development: Mandaviya to Tejashwi,"Reacting to Bihar Deputy CM Tejashwi Yadav's claim that Centre didn't approve construction of AIIMS in Darbhanga, Union Health Minister Mansukh Mandaviya said that Modi government doesn't do politics over development but it believes in politics of development. ""Centre had approved AIIMS Darbhanga's construction on September 19, 2020, and Bihar government allocated land on November 2021,"" he added.",Politics
FIR filed against Priyanka Gandhi's '50% commission' post against BJP in MP,"An FIR has been filed against the Twitter handles of Congress leaders Priyanka Gandhi, Kamal Nath and Arun Yadav over post that alleged Madhya Pradesh's BJP government is seeking ""50% commission"" for projects, police said. BJP's Nimesh Pathak said that a fake letter complaining that contractors in the state are being asked to pay 50% commission is being circulated.",Politics
Who asked Smriti Irani to catch Rahul Gandhi's flying kiss: Sarika,"Reacting to Union Minister Smriti Irani's claim that Congress leader Rahul Gandhi blew a flying kiss in Parliament, RJD leader Sarika Paswan said that Rahul gets proposals from Hollywood as well as Bollywood. She further added, ""Who asked Smriti Irani to catch Rahul Gandhi's flying kiss? Will she ever be able to prove that Rahul's flying kiss was for her?""",Politics
"Sharad, Ajit hold 'secret meeting', BJP MLA says 'They're family'","NCP chief Sharad Pawar and his nephew and Maharashtra Deputy CM Ajit Pawar are believed to have held a secret meeting at a businessman's residence in Pune on Saturday, according to reports. BJP MLA Atul Bhatkhalkar reacted to this, saying that Sharad and Ajit are ""family members"". State NCP (Sharad Pawar faction) President Jayant Patil was also reportedly present.",Politics
PM taking false credit for opening AIIMS in Darbhanga: Tejashwi,"
Bihar Deputy CM Tejashwi Yadav claimed that the central government did not approve the construction of AIIMS in Darbhanga despite the state government allocating 151 acres of land free of cost. Taking to X, Yadav said, ""Today, PM was taking false credit for opening the AIIMS in Darbhanga...The country expects PM to speak truth but he spoke a white lie"".",Politics
"Mockery of democracy, Parliament: Shiv Sena MP on PM's LS speech","Shiv Sena (UBT) MP Priyanka Chaturvedi on Saturday criticised PM Narendra Modi's speech in Lok Sabha and called it a ""mockery of democracy and a mockery of the Parliament"". ""That is why the Opposition chose to walk out,"" Chaturvedi said. ""Despite the walkout, the PM only chose to speak for about three to four minutes on Manipur,"" she added.",Politics
MP BJP files complaint against Priyanka over '50% commission' post,"BJP has filed a police complaint against Congress leader Priyanka Gandhi in Bhopal over her social media post accusing Madhya Pradesh government of seeking ""50% commission"" for projects. ""The people of Karnataka had ousted the '40% commission government', now the people of MP will remove BJP's '50% commission government' from power,"" she had said.",Politics
"Manipur was a family, BJP tried to destroy it: Rahul in Wayanad","Congress leader Rahul Gandhi, who is on a visit to his parliamentary constituency of Wayanad in Kerala, criticised the BJP over violence in Manipur. ""BJP aims at destroying families. India is a family, they want to divide it. Manipur was a family, they tried to destroy it,"" Rahul said. ""We [Congress] build, bring people together. We strengthen families,"" he added.",Politics
"Atishi gets 2 more depts, now has the highest portfolios among Delhi ministers","Delhi Minister Atishi has officially been given two more portfolios of Services and Vigilance departments, which were earlier held by her colleague, Saurabh Bharadwaj. Atishi now holds 14 portfolios, the highest among all ministers in the Delhi government. She was inducted into the Cabinet along with Bharadwaj in March this year.",Politics
TN minister Senthil Balaji sent to judicial custody till August 25,"Tamil Nadu minister V Senthil Balaji, who was arrested in an alleged cash-for-job scam case, has been sent to judicial custody till August 25. This comes after the five-day custodial interrogation by the Enforcement Directorate (ED) ended. The ED has filed a chargesheet of about 3,000 pages against Balaji in the money laundering case.",Politics
They chose to rub Hindi chauvinism: Tharoor on criminal law bills,"Congress leader Shashi Tharoor said that it wouldn't have cost the Centre anything to name the bills on proposed criminal laws in both Hindi and English as required under Article 348. ""But they (Centre) chose to rub their Hindi chauvinism into the faces of everyone else,"" added Tharoor. ""Yet another own-goal by the petty minds in the BJP,"" he said.",Politics
Rahul's thinking not democratic: BJP on 'army in Manipur' remark,"After Congress leader Rahul Gandhi suggested army intervention in Manipur, BJP leader Ravi Shankar Prasad criticised him and said his thinking is ""not democratic"". ""He (Rahul Gandhi) said the Indian Army can control it in two days, he wants the Indian Army to shoot Indians,"" Prasad said. ""Rahul Gandhi does not understand the country or the country's politics,"" he added.",Politics
Linguistic imperialism: TN CM as criminal law bills named in Hindi,"Tamil Nadu CM MK Stalin criticised the Centre as the three bills on proposed criminal laws - Bharatiya Nyaya Sanhita, Bharatiya Nagarik Suraksha Sanhita and Bharatiya Sakshya Bill - were named in Hindi. ""The audacious attempt by the Union BJP government to tamper with the essence of India's diversity through a sweeping overhaul…reeks of linguistic imperialism,"" he said.",Politics
"PM doesn't have right to speak on violence, corruption: WB CM","After PM Narendra Modi criticised West Bengal's TMC government over the violence during recent panchayat polls in the state, CM Mamata Banerjee said he doesn't have the ""moral right"" to speak on violence and corruption. ""It (the violence) was...planned and unleashed by the state unit of BJP...The PM should first learn political courtesy before saying such things,"" she added. ",Politics
"Rahul Gandhi dances with tribal people in Tamil Nadu, video out",A video has surfaced on social media showing Congress leader Rahul Gandhi performing a tribal dance with members of the Toda tribal community in a village near Ooty in Tamil Nadu. The video shows Rahul Gandhi donning the attire of tribal people. He can also be seen kissing a child on her cheek and greeting several others.,Politics
"Respect for PM Modi diminishing in BJP, revolt may happen: Raj CM","Rajasthan CM Ashok Gehlot has claimed that the respect for PM Narendra Modi in BJP is diminishing. ""Respect for PM Modi has not just gone down among the people but also in his own party,"" said CM Gehlot. He added that due to PM Modi's approach, his party is going against him and there could be a revolt against him.",Politics
I've been hanged before trial: Congress MP Adhir on his suspension,"After he was suspended from the Lok Sabha, Congress MP Adhir Ranjan Chowdhury on Saturday said he has been ""hanged"" first and then will be undergoing trial. ""I did not have even a remote objective to disparage or tarnish anyone whosoever [is] in the Parliament,"" Adhir said. ""If needed, I can approach the Supreme Court,"" he added.",Politics
BNS allows using draconian police powers for political ends: Sibal,"Rajya Sabha MP Kapil Sibal criticised the Bharatiya Nyaya Sanhita Bill brought by the Centre to replace Indian Penal Code. He said the proposed law allows using draconian police powers for political ends. He said that police by and large work under the directions of the political persons in power and hence, using the BNS, political opponents could be attacked.",Politics
Why are soldiers dying if there is peace in J&K: Farooq Abdullah,"Former CM Farooq Abdullah said that terrorism still prevails in Jammu and Kashmir and soldiers and people are still dying there. ""Why would these things happen if there really was peace?"" he asked. He said that the Kashmir issue can only be resolved through dialogue between India and Pakistan, not by fighting against each other.",Politics
"My lord, save our country: WB CM Mamata amid EC appointments row","After the Centre introduced a Bill that excludes Chief Justice of India from selection panel for Election Commissioners (ECs), West Bengal CM Mamata Banerjee criticised the Centre. ""Amidst calls to bow down to the judiciary, BJP instead bows to anarchy!"" Banerjee tweeted. ""Are they aiming to turn the judiciary into a minister-run kangaroo court?...My lord, save our country!"" she added.",Politics
Winning elections more demanding than cracking UPSC exams: KTR,"While interacting with students, Telangana minister KT Rama Rao said that winning elections is more demanding than cracking the UPSC examinations. He further said, ""Successful politics is always about one thing. If you, as a leader, are able to offer the hope that people's tomorrow is better than today, then you are going to survive, people [will vote for you].""",Politics
TMC played 'khooni khel' during Bengal panchayat polls: PM Modi,"Reacting to violence during panchayat polls in West Bengal, PM Narendra Modi said that ""TMC ne khooni khel khela hai"" (TMC played a game of blood). He alleged that TMC gave contracts to goons and asked them to capture booths. He added, ""They not only threaten BJP workers but also the voters...This is their way of doing politics.""",Politics
Investors beware: Mahua as Adani Ports auditor plans to resign,"After Deloitte reportedly decided to resign as auditor of Adani Ports over certain transactions flagged in a report, TMC MP Mahua Moitra warned investors. ""Now we're waiting for ED, CBI...to raid Deloitte! How can they refuse to audit government's most 'pyaara' group?"" Mahua said. Earlier, Deloitte had raised concerns over transactions between Adani Ports and three other entities.",Politics
Raghav Chadha changes Twitter bio to 'Suspended Member of Parliament',"Aam Aadmi Party leader Raghav Chadha has changed his Twitter bio to 'Suspended Member of Parliament'. This comes after he was suspended from the Rajya Sabha for ""gross violation of rule and misconduct"", pending a report by the Privileges Committee. Several Rajya Sabha MPs claimed Chadha named them in a house panel without their consent.",Politics
"PM Modi only cares about BJP, he has zero time for Manipur: Saket","TMC MP Saket Gokhale criticised PM Narendra Modi, saying that the Prime Minister has zero time to address Manipur and Haryana unrest. He further said that PM Modi only cares about BJP and that 'I.N.D.I.A' alliance cares about the country. He added, ""[PM Modi told BJP workers], 'No matter how busy I am, I find time for my party.'""",Politics
BJP leader Indrani found dead in Assam after private pics with senior BJP leader leaked,"Indrani Tahbildar, a notable woman leader of the Assam BJP, was found dead at her residence in Guwahati on Friday. The 48-year-old leader allegedly took her own life after intimate photographs of her with a senior BJP leader surfaced online. Authorities registered a case of unnatural death and launched an investigation into the circumstances surrounding the incident.",Politics
India has strict policy of zero tolerance against corruption: PM,"PM Narendra Modi virtually addressed the G20 Anti-Corruption Ministerial Meeting and said that India has a strict policy of zero tolerance against corruption. The Prime Minister further said, ""I am glad that an understanding has been reached on informal cooperation between the law enforcement agencies, as it will prevent criminals from exploiting legal loopholes.""",Politics
Don't know what 'bla...bla' PM was saying in Parliament: Sanjay,"Reacting to PM Narendra Modi's reply on the no-confidence motion in Parliament, AAP MP Sanjay Singh said that the Prime Minister has lost his mental stability. He further said, ""I don't know what 'bla…bla' PM Modi was saying during his speech in Parliament...The Prime Minister's aim is not to stop violence in Manipur, but to stop Sanjay Singh.""",Politics
"MPs of I.N.D.I.A alliance playing ludo, PM playing chess: Owaisi","AIMIM chief Asaduddin Owaisi criticised I.N.D.I.A alliance, saying that MPs of the alliance are playing ludo while PM Narendra Modi is playing chess. He further added that I.N.D.I.A MPs didn't discuss crucial bills in Parliament and staged a walkout. He added, ""Nitish Kumar became Bihar CM for the first time due to BJP's help...Now he is claiming to be secular.""",Politics
Listen to 'Mann Ki Baat' of Muslims: Jama Masjid Shahi Imam to PM,"Jama Masjid's Shahi Imam Syed Ahmed Bukhari urged PM Narendra Modi to listen to the 'Mann Ki Baat' of Muslims. He said that the situation in India is worrisome and that a storm of hatred is posing grave danger. He added, ""Muslims are troubled due to prevailing conditions and worried about their future…People of one faith are being openly threatened.""",Politics
How dare Mamata say Hindu genocide in Kashmir is propaganda: Vivek,"'The Kashmir Files' director Vivek Agnihotri, who sent legal notice to West Bengal CM Mamata Banerjee over alleged ""defamatory"" remarks on the film in May, said he'll keep fighting for it. Vivek said, ""How [dare Mamata Banerjee] say...genocide of Hindus in Kashmir is a propaganda?"" ""Perhaps I'm the only filmmaker who has ever sued a sitting chief minister,"" he added.",Politics
Nehru-Gandhi family sowed the seeds of hatred in Manipur: Thakur,"Union Minister Anurag Thakur alleged that the Nehru-Gandhi family sowed seeds of hatred in Manipur for political gains. He further said that the Northeast was known for ""Bomb, Bandh and Blast"" under the Congress. He added, ""Your policy was 'Look East', but PM Modi started the 'Act East' policy...Centre is taking all possible steps to establish peace in Manipur.""",Politics
Will retire from politics if proved I took commission: Shivakumar,"Karnataka Deputy CM DK Shivakumar said he would retire from politics if it is proved that he took commission (bribe). Criticising BJP leaders for accusing him of collecting commission, he said, ""But will [Basavaraj] Bommai and [R] Ashoka announce their political retirement if their (allegations) are proved wrong?"" Shivakumar said. Basavaraj Bommai accused the Congress of indulging in corruption.",Politics
AAP MP Sushil Kumar Rinku comes to Parliament in chains to protest suspension,"AAP MP Sushil Kumar Rinku reached the Parliament complex in chains on Friday to protest against his suspension from Lok Sabha. He roamed around the complex raising slogans ""Free country's democracy from chains of slavery"" and ""Respect Bhim Rao Ambedkar's Constitution"". He tore some papers in the well following the passage of the Delhi service bill on August 3.",Politics
Insult to Parliament: Karandlaje on Adhir's remarks on PM Modi,"After Congress MP Adhir Ranjan Chowdhury was suspended from the Lok Sabha, Union Minister Shobha Karandlaje criticised him over his remarks on PM Narendra Modi. ""What Adhir Ranjan Chowdhury said yesterday was very wrong. [Around] 140 crore people of the country were watching you...This wasn't an insult to...BJP or the government, you were trying to insult the Parliament,"" she said.",Politics
Is Rahul suggesting army firing on civilians in Manipur: Assam CM,"Assam CM Himanta Biswa Sarma on Friday criticised Congress leader Rahul Gandhi over his suggestion of army intervention in Manipur. ""Rahul Gandhi said Indian Army should stop the violence in Manipur. That means what? They should open fire on civilians?"" Himanta questioned. ""How can he say that? Army will not be able to solve anything,"" he added.",Politics
"Oppn talks about murder of Constitution, Bharat Mata: Thakur","Union Minister Anurag Thakur on Friday criticised the Opposition and said that only supporters of 'Tukde-Tukde' gang can think of dividing, killing 'Bharat Mata'. ""They talk about the murder of Constitution, Bharat Mata,"" Thakur said. ""Rahul Gandhi is not worried about the women of Rajasthan, he differentiates between the women of West Bengal, Bihar, Manipur,"" Thakur said. ",Politics
Lost his mental balance: Pralhad Joshi on Rahul's remarks on PM,"Reacting to Rahul Gandhi's remarks on PM Narendra Modi's reply to the no-confidence motion, Union Minister Pralhad Joshi on Friday criticised him. ""I think Rahul Gandhi lost his mental balance, it appears like that,"" Joshi said. ""He hasn't heard...[PM Modi's] reply. He didn't come to the House...It is very unfortunate...the so-called grand old party is behaving so irresponsibly,"" Joshi added.",Politics
"Not afraid, will fight till end: AAP MP Chadha on his suspension","After being suspended from Rajya Sabha, AAP MP Raghav Chadha said that he is ""not afraid and will fight till the end"". He said that BJP doesn't want anyone to question them. He rejected the accusations of forging signatures of fellow parliamentarians, saying that any MP can propose the name of another member for the formation of a select committee.",Politics
Astonishingly undemocratic: Shashi Tharoor on Adhir's suspension,"Commenting on Congress MP Adhir Ranjan Chowdhury's suspension from Lok Sabha, party leader Shashi Tharoor called it ""astonishingly undemocratic"". ""The...trigger appears to have been him mentioning Nirav Modi in the same sentence as Narendra Modi. But, he was making a point that 'Nirav' the name means silent, quiet,"" Tharoor said, adding Adhir was saying that PM was silent on Manipur. ",Politics
Cracking jokes while Manipur burning doesn't suit PM: Rahul Gandhi,"A day after PM Narendra Modi's reply to the no-confidence motion, Congress leader Rahul Gandhi said that PM Modi doesn't want to douse the fire in Manipur and this is the truth of Manipur. ""I heard PM Modi speaking in Parliament. He was cracking jokes, laughing with NDA MPs sloganeering. It does not behove a prime minister,"" Gandhi said.",Politics
Those in NDA out of fear will jump ship at time of polls: Nitish,"Bihar CM Nitish Kumar on Friday claimed that many NDA leaders are with PM Narendra Modi-led BJP ""out of fear"" and would jump ship at the time of elections. Commenting on PM Modi's 'ghamandia' remark, he said, ""All of us have joined hands for the betterment of the country."" Notably, Nitish Kumar cut ties with the BJP a year ago.",Politics
"PM's LS speech had no substance, disappointed everyone: Tejashwi","Bihar Deputy CM Tejashwi Yadav on Friday said the speech given by PM Narendra Modi in Lok Sabha has disappointed everyone. ""The Prime Minister's speech had no substance. His body language was also jittery,"" Tejashwi Yadav said. ""BJP is scared because of our unity. We've won in Bihar and will win in the rest of the country too,"" he added.",Politics
PM's LS speech shows he has no roadmap for peace in Manipur: Gogoi,"Congress MP Gaurav Gogoi criticised PM Narendra Modi's speech in the Parliament on Thursday and said that PM Modi's speech shows he has no clear roadmap to restore peace in Manipur. ""PM forgot to talk about Manipur, he did not take any responsibility for the failures of his Chief Minister or for the Union Home Minister,"" Gogoi said.",Politics
AAP MP Sanjay’s suspension to continue beyond current session,"Rajya Sabha Chairman Jagdeep Dhankhar on Friday announced that AAP MP Sanjay Singh's suspension from the House would continue beyond the current Monsoon Session. He referred the matter to the Committee of Privileges. The suspension will continue ""till the Council has the benefit of recommendation by the Committee of Privileges"", said Dhankhar. ",Politics
"Ex-Maharashtra minister Nawab Malik, in jail since 2022, granted bail by SC","The Supreme Court on Friday granted two months' bail to former Maharashtra minister and NCP (Sharad Pawar) leader Nawab Malik on medical grounds. He has been in jail since February 2022 in connection to a money laundering case. In June, while opposing Malik's bail plea in the Bombay High Court, the Enforcement Directorate said many people survive on one kidney. ",Politics
Pic of Advani's old letter to ex-PM Manmohan surfaces amid EC appointments row,"Congress shared a picture of a letter BJP's LK Advani wrote to then PM Manmohan Singh in 2012 over appointments to Election Commission (EC). ""There is rapidly growing opinion...which holds that appointments to Constitutional bodies like EC should be done on bipartisan basis,"" Advani said. Centre has introduced a Bill that excludes Chief Justice from selection panel for Election Commissioners.",Politics
